Name,Code,Price,Description,Dimensions,Thumbnail Image,Detail Image,Extra Large Image,Detail Page Link,Shopping Cart Link,Everyday,Birthday,Anniversary,Love and Romance,Get Well,New Baby,Thank You,Sympathy,Category
Reflections of Glory Wreath,T241-1A,264.9500,"A stunning display of patriotism, strength and sympathy. This red, white and blue wreath delivers a lovely message about the dignity of the deceased. A lovely array of flowers such as blue hydrangea, red roses and spray roses, delicate blue delphinium, red gladioli, white cushion spray chrysanthemums and more create a circle of serene beauty.",24 1/2" h x 24 1/2" w,https://cdn.floristone.com/small/T241-1A_t1.jpg,https://cdn.floristone.com/large/T241-1A_d1.jpg,https://cdn.floristone.com/hi-res/T241-1A_h1.jpg,http://www.floristone.com/detail.cfm?dcode=T241-1A&source_id=aff&affiliateid=2026051528,http://www.floristone.com/cart.cfm?dcode=T241-1A&source_id=aff&affiliateid=2026051528,0,0,0,0,0,0,0,1,Funeral - Wreaths
Graceful Grandeur Casket Spray,T242-1A,274.9500,"Joyous times and golden memories are recalled with this lovely half-couch casket spray that consoles the bereaved with a sunny array of beautiful blooms. A bevy of yellow blossoms such as roses, gladioli, chrysanthemums and more are perfectly arranged in this lovely casket spray.",22" h x 44" w,https://cdn.floristone.com/small/T242-1A_t1.jpg,https://cdn.floristone.com/large/T242-1A_d1.jpg,https://cdn.floristone.com/hi-res/T242-1A_h1.jpg,http://www.floristone.com/detail.cfm?dcode=T242-1A&source_id=aff&affiliateid=2026051528,http://www.floristone.com/cart.cfm?dcode=T242-1A&source_id=aff&affiliateid=2026051528,0,0,0,0,0,0,0,1,Funeral - Casket Sprays
Adoration Casket Spray,T242-2A,264.9500,This classic half-couch spray of brilliant red carnations makes a striking and dignified statement. Radiant red carnations and miniature carnations accented by fresh greenery arrive in a lovely spray.,27" h x 36" w,https://cdn.floristone.com/small/T242-2A_t1.jpg,https://cdn.floristone.com/large/T242-2A_d1.jpg,https://cdn.floristone.com/hi-res/T242-2A_h1.jpg,http://www.floristone.com/detail.cfm?dcode=T242-2A&source_id=aff&affiliateid=2026051528,http://www.floristone.com/cart.cfm?dcode=T242-2A&source_id=aff&affiliateid=2026051528,0,0,0,0,0,0,0,1,Funeral - Casket Sprays
Strength and Wisdom Casket Spray,T242-3A,239.9500,"This beautiful red and white spray will deliver strength and the wisdom to know that there will be brighter days ahead. Dazzling red roses and gerberas, brilliant white chrysanthemums and larkspur are arranged with gentle greens to create a strong yet soothing arrangement.",21" h x 39" w,https://cdn.floristone.com/small/T242-3A_t1.jpg,https://cdn.floristone.com/large/T242-3A_d1.jpg,https://cdn.floristone.com/hi-res/T242-3A_h1.jpg,http://www.floristone.com/detail.cfm?dcode=T242-3A&source_id=aff&affiliateid=2026051528,http://www.floristone.com/cart.cfm?dcode=T242-3A&source_id=aff&affiliateid=2026051528,0,0,0,0,0,0,0,1,Funeral - Casket Sprays
Bountiful Memories Casket Spray,T242-4A,289.9500,"A casket spray made of all white flowers and simple greenery is a simply stunning way to honor the deceased while bringing a quiet strength and serenity to those present. Gorgeous white oriental lilies, gladioli, carnations and more create a beautiful crescent shaped casket spray.",27" h x 49" w,https://cdn.floristone.com/small/T242-4A_t1.jpg,https://cdn.floristone.com/large/T242-4A_d1.jpg,https://cdn.floristone.com/hi-res/T242-4A_h1.jpg,http://www.floristone.com/detail.cfm?dcode=T242-4A&source_id=aff&affiliateid=2026051528,http://www.floristone.com/cart.cfm?dcode=T242-4A&source_id=aff&affiliateid=2026051528,0,0,0,0,0,0,0,1,Funeral - Casket Sprays
Golden Garden Casket Spray,T243-1A,394.9500,"In our darkest hours, a radiant display of sunshine is sure to warm hearts, especially when the sunshine is delivered in such a beautiful way. This spray offers an abundance of brilliant yellow blossoms. Sunny yellow roses, spray roses, carnations, chrysanthemums, snapdragons and more are arranged in a dazzling full casket spray.",16" h x 64" w,https://cdn.floristone.com/small/T243-1A_t1.jpg,https://cdn.floristone.com/large/T243-1A_d1.jpg,https://cdn.floristone.com/hi-res/T243-1A_h1.jpg,http://www.floristone.com/detail.cfm?dcode=T243-1A&source_id=aff&affiliateid=2026051528,http://www.floristone.com/cart.cfm?dcode=T243-1A&source_id=aff&affiliateid=2026051528,0,0,0,0,0,0,0,1,Funeral - Casket Sprays
Sentimental Dreams,T244-1A,124.9500,"Because you will remember the loved one with every sunrise and every sunset. Because someone special made your life brighter. For these reasons and more, this brilliant arrangement will be much appreciated. A lovely assortment of flowers such as fiery orange roses, gerberas and gladioli, ti leaves, magnolia leaves and more are beautifully arranged in an exclusive Noble Heritage urn.Color and style of container may vary.",38" h x 20" w,https://cdn.floristone.com/small/T244-1A_t1.jpg,https://cdn.floristone.com/large/T244-1A_d1.jpg,https://cdn.floristone.com/hi-res/T244-1A_h1.jpg,http://www.floristone.com/detail.cfm?dcode=T244-1A&source_id=aff&affiliateid=2026051528,http://www.floristone.com/cart.cfm?dcode=T244-1A&source_id=aff&affiliateid=2026051528,0,0,0,0,0,0,0,1,Funeral - Table Arrangements
Ocean Breeze Spray,T246-2A,184.9500,"Express deep condolences and strong hopes for the future with an elegant tribute that conveys admiration, affection and respect. Lovely flowers such as white asiatic lilies and roses blend with blue delphinium and hydrangea, set amidst ferns.",39" h x 21" w,https://cdn.floristone.com/small/T246-2A_t1.jpg,https://cdn.floristone.com/large/T246-2A_d1.jpg,https://cdn.floristone.com/hi-res/T246-2A_h1.jpg,http://www.floristone.com/detail.cfm?dcode=T246-2A&source_id=aff&affiliateid=2026051528,http://www.floristone.com/cart.cfm?dcode=T246-2A&source_id=aff&affiliateid=2026051528,0,0,0,0,0,0,0,1,Funeral - Sprays
Rays of Light Spray,T246-4A,189.9500,"This stunning spray is a beautiful and touching display of your sympathy and devotion. A lovely composition of flowers such as green roses, gladioli and button spray chrysanthemums, pink spray roses and carnations, light pink oriental lilies and snapdragons are arranged with a mix of beautiful greenery in a standing spray of flowers that's delivered on an easel.",46" h x 29" w,https://cdn.floristone.com/small/T246-4A_t1.jpg,https://cdn.floristone.com/large/T246-4A_d1.jpg,https://cdn.floristone.com/hi-res/T246-4A_h1.jpg,http://www.floristone.com/detail.cfm?dcode=T246-4A&source_id=aff&affiliateid=2026051528,http://www.floristone.com/cart.cfm?dcode=T246-4A&source_id=aff&affiliateid=2026051528,0,0,0,0,0,0,0,1,Funeral - Sprays
Heavenly Sentiments Spray,T247-2A,209.9500,"Fresh roses and opulent blooms such as orchids and gladioli – in celestial colors of green, purple and lavender – create a fine and appropriate floral standing spray. Send this gift as a representation of your thoughtfulness and devotion. A standing spray created from fresh flowers such as gladioli, roses, dendrobium orchids and hydrangea – in shades of green, purple and lavender – is delivered on an easel.",35" h x 24" w,https://cdn.floristone.com/small/T247-2A_t1.jpg,https://cdn.floristone.com/large/T247-2A_d1.jpg,https://cdn.floristone.com/hi-res/T247-2A_h1.jpg,http://www.floristone.com/detail.cfm?dcode=T247-2A&source_id=aff&affiliateid=2026051528,http://www.floristone.com/cart.cfm?dcode=T247-2A&source_id=aff&affiliateid=2026051528,0,0,0,0,0,0,0,1,Funeral - Sprays
Heavenly Grace Spray,T248-1A,189.9500,"A sublime garden of rich yet subtle hues is a touching tribute to a lifetime of memories and special moments as varied and dear as this palette of blooms. A lovely assortment of flowers such as pink roses, larkspur, asiatic lilies, gerberas and sinuata statice, with peach roses and carnations, purple stock and limonium, and bells of Ireland on a classic easel.",30" h x 23" w,https://cdn.floristone.com/small/T248-1A_t1.jpg,https://cdn.floristone.com/large/T248-1A_d1.jpg,https://cdn.floristone.com/hi-res/T248-1A_h1.jpg,http://www.floristone.com/detail.cfm?dcode=T248-1A&source_id=aff&affiliateid=2026051528,http://www.floristone.com/cart.cfm?dcode=T248-1A&source_id=aff&affiliateid=2026051528,0,0,0,0,0,0,0,1,Funeral - Sprays
Finest Farewell Spray,T248-2A,209.9500,"Utterly feminine, this spray is an extraordinarily beautiful way to bid farewell to someone who will remain forever in your heart. A bevy of lovely lavender flowers will soothe souls and deliver strength and hope to those in mourning. Beautiful flowers such as lavender, purple and pink blossoms including roses, larkspur, alstroemeria and more are beautifully arranged. A pretty pink organza ribbon completes this fine farewell.",50" h x 22" w,https://cdn.floristone.com/small/T248-2A_t1.jpg,https://cdn.floristone.com/large/T248-2A_d1.jpg,https://cdn.floristone.com/hi-res/T248-2A_h1.jpg,http://www.floristone.com/detail.cfm?dcode=T248-2A&source_id=aff&affiliateid=2026051528,http://www.floristone.com/cart.cfm?dcode=T248-2A&source_id=aff&affiliateid=2026051528,0,0,0,0,0,0,0,1,Funeral - Sprays
Sweet Solace Spray,T249-1A,169.9500,"Rejoice with this softly dramatic cascade of pink and yellow blooms – lilies, gladioli and chrysanthemums – that has hints of eucalyptus and variegated greens. Stems of flowers such as pink lilies, gladioli and carnations with yellow snapdragons, and daisy spray mums, accented by variegated greens and eucalyptus.",43" h x 38" w,https://cdn.floristone.com/small/T249-1A_t1.jpg,https://cdn.floristone.com/large/T249-1A_d1.jpg,https://cdn.floristone.com/hi-res/T249-1A_h1.jpg,http://www.floristone.com/detail.cfm?dcode=T249-1A&source_id=aff&affiliateid=2026051528,http://www.floristone.com/cart.cfm?dcode=T249-1A&source_id=aff&affiliateid=2026051528,0,0,0,0,0,0,0,1,Funeral - Sprays
Pink Tribute Spray,T249-2A,149.9500,"With a bounty of lovely pink flowers and simple greens, this pretty spray lets you express your sympathy beautifully. Splendid pink, hot pink and light pink flowers such as alstroemeria, gladioli, carnations, asters and more create a display that is warm and loving.",31 1/2" h x 22" w,https://cdn.floristone.com/small/T249-2A_t1.jpg,https://cdn.floristone.com/large/T249-2A_d1.jpg,https://cdn.floristone.com/hi-res/T249-2A_h1.jpg,http://www.floristone.com/detail.cfm?dcode=T249-2A&source_id=aff&affiliateid=2026051528,http://www.floristone.com/cart.cfm?dcode=T249-2A&source_id=aff&affiliateid=2026051528,0,0,0,0,0,0,0,1,Funeral - Sprays
Bright and Beautiful Spray,T249-3A,184.9500,"Reflecting the many colors of life, a rich spectrum of blooms evokes the range of emotions experienced in remembering a cherished loved one. A lovely assortment of flowers such as lavender gladioli and cushion spray chrysanthemums, yellow snapdragons, carnations and daisy spray chrysanthemums, hot pink roses, purple hydrangea, asters and assorted greens are all presented on an easel.",55" h x 29" w,https://cdn.floristone.com/small/T249-3A_t1.jpg,https://cdn.floristone.com/large/T249-3A_d1.jpg,https://cdn.floristone.com/hi-res/T249-3A_h1.jpg,http://www.floristone.com/detail.cfm?dcode=T249-3A&source_id=aff&affiliateid=2026051528,http://www.floristone.com/cart.cfm?dcode=T249-3A&source_id=aff&affiliateid=2026051528,0,0,0,0,0,0,0,1,Funeral - Sprays
Sacred Garden Spray,T249-4A,239.9500,"A lovely lavender spray of flowers lets you share your compassion, hope and beauty with all. Beautifully simple. Beautifully serene. It's the perfect way to send your sincere sympathy. Lavender, purple and white flowers like hydrangea, orchids, roses, oriental lilies and more create a beautiful spray. A wonderful tribute.",51" h x 26" w,https://cdn.floristone.com/small/T249-4A_t1.jpg,https://cdn.floristone.com/large/T249-4A_d1.jpg,https://cdn.floristone.com/hi-res/T249-4A_h1.jpg,http://www.floristone.com/detail.cfm?dcode=T249-4A&source_id=aff&affiliateid=2026051528,http://www.floristone.com/cart.cfm?dcode=T249-4A&source_id=aff&affiliateid=2026051528,0,0,0,0,0,0,0,1,Funeral - Sprays
Meadows of Memories,T250-1A,199.9500,"A subdued assortment of flowers such as lavender larkspur, roses and asters are grouped beautifully with the rich greens of cymbidium orchids, chrysanthemums, English boxwood and sword fern.Please note: Arrangement does not include urn.",23" W x 20" H,https://cdn.floristone.com/small/T250-1A_t1.jpg,https://cdn.floristone.com/large/T250-1A_d1.jpg,https://cdn.floristone.com/hi-res/T250-1A_h1.jpg,http://www.floristone.com/detail.cfm?dcode=T250-1A&source_id=aff&affiliateid=2026051528,http://www.floristone.com/cart.cfm?dcode=T250-1A&source_id=aff&affiliateid=2026051528,0,0,0,0,0,0,0,1,Funeral
Joyful Memory,T251-1A,119.9500,"Lavender and white sympathy flowers make a grand statement in this joyful bouquet. Cherish your memories with this lasting remembrance of lavender larkspur and roses, deep purple asters, pure white gladioli and the softest pink heather. A classic assortment of flowers such as lavender larkspur, stock and roses, plus purple asters, white gladioli and pink heather.",32" h x 20" w,https://cdn.floristone.com/small/T251-1A_t1.jpg,https://cdn.floristone.com/large/T251-1A_d1.jpg,https://cdn.floristone.com/hi-res/T251-1A_h1.jpg,http://www.floristone.com/detail.cfm?dcode=T251-1A&source_id=aff&affiliateid=2026051528,http://www.floristone.com/cart.cfm?dcode=T251-1A&source_id=aff&affiliateid=2026051528,0,0,0,0,0,0,0,1,Funeral - Table Arrangements
Rainbow Reflections Basket,T252-1A,104.9500,"Soft and soothing. This basket is overflowing with pastel flowers and your sincere message of hope to those in mourning. Beautiful flowers such as pink carnations and alstroemeria, lavender button and daisy spray chrysanthemums along with white cushion spray chrysanthemums and more fill a lovely round wicker basket.",21" h  x 25" w,https://cdn.floristone.com/small/T252-1A_t1.jpg,https://cdn.floristone.com/large/T252-1A_d1.jpg,https://cdn.floristone.com/hi-res/T252-1A_h1.jpg,http://www.floristone.com/detail.cfm?dcode=T252-1A&source_id=aff&affiliateid=2026051528,http://www.floristone.com/cart.cfm?dcode=T252-1A&source_id=aff&affiliateid=2026051528,0,0,0,0,0,0,0,1,Funeral - Baskets
Bed of Pink Roses,T253-2A,224.9500,An awesome display of pink roses are lovingly arranged with ivy and other gentle greens to display the urn.Please note: Arrangement does not include urn.,33 W x 20 H,https://cdn.floristone.com/small/T253-2A_t1.jpg,https://cdn.floristone.com/large/T253-2A_d1.jpg,https://cdn.floristone.com/hi-res/T253-2A_h1.jpg,http://www.floristone.com/detail.cfm?dcode=T253-2A&source_id=aff&affiliateid=2026051528,http://www.floristone.com/cart.cfm?dcode=T253-2A&source_id=aff&affiliateid=2026051528,0,0,0,0,0,0,0,1,Funeral
Your Light Shines,T253-3A,119.9500,"This softly elegant gesture of condolence and affection honoring the memory of a life well lived is a gentle touch during a difficult time. Lavender and pink flowers such as roses, hydrangea, monte cassino asters, eucalyptus and salal are arranged in a clear glass hurricane vase.",17" h x 15 1/2" w,https://cdn.floristone.com/small/T253-3A_t1.jpg,https://cdn.floristone.com/large/T253-3A_d1.jpg,https://cdn.floristone.com/hi-res/T253-3A_h1.jpg,http://www.floristone.com/detail.cfm?dcode=T253-3A&source_id=aff&affiliateid=2026051528,http://www.floristone.com/cart.cfm?dcode=T253-3A&source_id=aff&affiliateid=2026051528,1,1,1,1,0,1,0,1,Funeral - Table Arrangements
Sunset Wreath,T254-1A,209.9500,"Orange roses blend with other beautiful flowers such as stems of cymbidium orchids, gladioli, chrysanthemums, hypericum and other delicate greens.Please note: Arrangement does not include urn.",26" W x 16 H,https://cdn.floristone.com/small/T254-1A_t1.jpg,https://cdn.floristone.com/large/T254-1A_d1.jpg,https://cdn.floristone.com/hi-res/T254-1A_h1.jpg,http://www.floristone.com/detail.cfm?dcode=T254-1A&source_id=aff&affiliateid=2026051528,http://www.floristone.com/cart.cfm?dcode=T254-1A&source_id=aff&affiliateid=2026051528,0,0,0,0,0,0,0,1,Funeral
Garden Wreath,T255-1A,169.9500,"This luxurious wreath includes flowers such as carnations, chrysanthemums, silky green cymbidium orchid blossoms and variegated greenery. Please note: Arrangement does not include picture frame.",20" W x 15" H,https://cdn.floristone.com/small/T255-1A_t1.jpg,https://cdn.floristone.com/large/T255-1A_d1.jpg,https://cdn.floristone.com/hi-res/T255-1A_h1.jpg,http://www.floristone.com/detail.cfm?dcode=T255-1A&source_id=aff&affiliateid=2026051528,http://www.floristone.com/cart.cfm?dcode=T255-1A&source_id=aff&affiliateid=2026051528,0,0,0,0,0,0,0,1,Funeral
Richly Remembered,T255-2A,264.9500,"If you are lucky enough to have a treasured photograph, or other memento of someone dear, this is such a lovely way of sharing your memories with others. Pretty blossoms and greenery create a beautiful framework for your tribute. Stunning flowers such as hydrangea, dazzling green cymbidium orchids, roses, gladioli, bells of Ireland and more make this an incredible display of respect.",22" h x 22" w,https://cdn.floristone.com/small/T255-2A_t1.jpg,https://cdn.floristone.com/large/T255-2A_d1.jpg,https://cdn.floristone.com/hi-res/T255-2A_h1.jpg,http://www.floristone.com/detail.cfm?dcode=T255-2A&source_id=aff&affiliateid=2026051528,http://www.floristone.com/cart.cfm?dcode=T255-2A&source_id=aff&affiliateid=2026051528,0,0,0,0,0,0,0,1,Funeral - Wreaths
Say It With Sunshine,T26-1A,79.9500,"Say it with sweetness. Say it with flowers. Say it with sunshine. A bouquet this brilliant can deliver almost any sentiment – birthday, congratulations, thinking of you... you name it. When you want to say something beautifully, this bouquet beckons. Dazzling yellow roses, spray roses, asiatic lilies and daisy spray chrysanthemums, along with green button spray chrysanthemums and more fill a green Satin Cylinder vase. Say it, seal it, and send it with sunshine!Container and/ or color of container may vary.",15" h x 13 1/2" w,https://cdn.floristone.com/small/T26-1A_t1.jpg,https://cdn.floristone.com/large/T26-1A_d1.jpg,https://cdn.floristone.com/hi-res/T26-1A_h1.jpg,http://www.floristone.com/detail.cfm?dcode=T26-1A&source_id=aff&affiliateid=2026051528,http://www.floristone.com/cart.cfm?dcode=T26-1A&source_id=aff&affiliateid=2026051528,1,1,1,1,1,0,1,0,Centerpieces
Oh Happy Day,T27-1A,79.9500,"Oh, what a happy day it will be for whoever is lucky enough to have this vase full of joyful and jubilant blossoms delivered to them. Perfect for Happy Birthday or Happy Any Day, this pretty arrangement is sure to inspire smiles! Carnations and button spray chrysanthemums, yellow asiatic lilies and gladioli along with fresh greens fill a rectangular glass vase. Come on! Say it and send it like you mean it… Oh Happy Day!",10" h x 12" w,https://cdn.floristone.com/small/T27-1A_t1.jpg,https://cdn.floristone.com/large/T27-1A_d1.jpg,https://cdn.floristone.com/hi-res/T27-1A_h1.jpg,http://www.floristone.com/detail.cfm?dcode=T27-1A&source_id=aff&affiliateid=2026051528,http://www.floristone.com/cart.cfm?dcode=T27-1A&source_id=aff&affiliateid=2026051528,1,1,1,1,1,1,1,0,Centerpieces
Basket Full of Wishes,T27-2A,84.9500,"Wishes do come true, by the basketful, actually. This delightful arrangement is so full of sunny blossoms, it even includes a pretty yellow butterfly who obviously feels right at home, basking in the warmth. Brilliant yellow spray roses, asiatic lilies, miniature gerberas, carnations, alstroemeria, button spray chrysanthemums and delightful greenery are joined by a delicate butterfly in an oval basket. It's a basket of wonder and wishes!",11" h x 12" w,https://cdn.floristone.com/small/T27-2A_t1.jpg,https://cdn.floristone.com/large/T27-2A_d1.jpg,https://cdn.floristone.com/hi-res/T27-2A_h1.jpg,http://www.floristone.com/detail.cfm?dcode=T27-2A&source_id=aff&affiliateid=2026051528,http://www.floristone.com/cart.cfm?dcode=T27-2A&source_id=aff&affiliateid=2026051528,1,1,1,1,1,1,1,0,Centerpieces
Shades Of Faith,T273-7A,149.9500,"Pink stargazer lilies, lavender roses and yellow snapdragons are arranged with peach gerberas, hot pink carnations, lavender stock, bells of Ireland, purple larkspur, spiral eucalyptus and lemon leaf. Arrangement does not include urn.",29" W x 25" H,https://cdn.floristone.com/small/T273-7A_t1.jpg,https://cdn.floristone.com/large/T273-7A_d1.jpg,https://cdn.floristone.com/hi-res/T273-7A_h1.jpg,http://www.floristone.com/detail.cfm?dcode=T273-7A&source_id=aff&affiliateid=2026051528,http://www.floristone.com/cart.cfm?dcode=T273-7A&source_id=aff&affiliateid=2026051528,0,0,0,0,0,0,0,1,Funeral
Forever In Our Hearts Cremation Tribute,T280-1A,209.9500,"Red roses are arranged with myrtle, green ivy, sword fern, silver dollar eucalyptus, and lemon leaf. Arrangement does not include urn.",32 W x 25 H,https://cdn.floristone.com/small/T280-1A_t1.jpg,https://cdn.floristone.com/large/T280-1A_d1.jpg,https://cdn.floristone.com/hi-res/T280-1A_h1.jpg,http://www.floristone.com/detail.cfm?dcode=T280-1A&source_id=aff&affiliateid=2026051528,http://www.floristone.com/cart.cfm?dcode=T280-1A&source_id=aff&affiliateid=2026051528,0,0,0,0,0,0,0,1,Funeral
With All Our Hearts Cremation Tribute,T282-4A,184.9500,"This colorful arrangement includes green hydrangea, yellow roses, hot pink spray roses, orange asiatic lilies, yellow sunflowers, bells of Ireland, blue delphinium, orange snapdragons, purple stock, curly willow, cedar stem, sword fern, aralia leaf, and lemon leaf. Arrangement does not include urn.",33" W x 27" H,https://cdn.floristone.com/small/T282-4A_t1.jpg,https://cdn.floristone.com/large/T282-4A_d1.jpg,https://cdn.floristone.com/hi-res/T282-4A_h1.jpg,http://www.floristone.com/detail.cfm?dcode=T282-4A&source_id=aff&affiliateid=2026051528,http://www.floristone.com/cart.cfm?dcode=T282-4A&source_id=aff&affiliateid=2026051528,0,0,0,0,0,0,0,1,Funeral
Here's to You,T29-1A,79.9500,"Whether you are raising a vase to celebrate a birthday, a new job or any other occasion, here's the one to send. So bright, so beautiful, so colorful – men and women alike will appreciate your thoughtfulness. Brilliant blue hydrangea, yellow roses, red gerberas and miniature carnations, yellow button spray chrysanthemums are delivered in a vase. Here's to celebrating!Style of vase may vary.",19 1/2" h x 16 1/2" w,https://cdn.floristone.com/small/T29-1A_t1.jpg,https://cdn.floristone.com/large/T29-1A_d1.jpg,https://cdn.floristone.com/hi-res/T29-1A_h1.jpg,http://www.floristone.com/detail.cfm?dcode=T29-1A&source_id=aff&affiliateid=2026051528,http://www.floristone.com/cart.cfm?dcode=T29-1A&source_id=aff&affiliateid=2026051528,1,1,1,1,1,0,1,0,Vase Arrangements
Amazing Daisy,T32-1A,79.9500,"Celebrate the brightest of occasions with this cheerful bouquet of happy-faced daisies presented in a graceful, vase. Yellow roses and spray roses, white daisy spray chrysanthemums, solidago and pittosporum fill a lovely Inspiration vase. Amazingly pretty!",14" h x 11" w,https://cdn.floristone.com/small/T32-1A_t1.jpg,https://cdn.floristone.com/large/T32-1A_d1.jpg,https://cdn.floristone.com/hi-res/T32-1A_h1.jpg,http://www.floristone.com/detail.cfm?dcode=T32-1A&source_id=aff&affiliateid=2026051528,http://www.floristone.com/cart.cfm?dcode=T32-1A&source_id=aff&affiliateid=2026051528,1,1,1,1,1,1,0,0,Vase Arrangements
Once Upon a Daisy,T34-1A,79.9500,"This bright and sunny bouquet is as sweet as a fairy tale ending. Perfect for baby showers, birthdays and beyond. Beautiful light blue hydrangea, cheerful yellow gerberas and white daisy spray chrysanthemums are delivered in a light blue Satin Cylinder that comes complete with a pretty light blue ribbon. Blue skies ahead!",14" h x 13 1/2" w,https://cdn.floristone.com/small/T34-1A_t1.jpg,https://cdn.floristone.com/large/T34-1A_d1.jpg,https://cdn.floristone.com/hi-res/T34-1A_h1.jpg,http://www.floristone.com/detail.cfm?dcode=T34-1A&source_id=aff&affiliateid=2026051528,http://www.floristone.com/cart.cfm?dcode=T34-1A&source_id=aff&affiliateid=2026051528,1,1,1,0,1,1,1,0,Centerpieces
Lovely Lady,T36-1A,79.9500,"Isn't she lovely? Isn't she wonderful? Perfect for celebrating new baby girls and new moms, this pretty arrangement has feminine charm to spare! Lovely light pink roses, miniature gerberas and miniature carnations along with pink gerberas, seeded eucalyptus and pretty pink ribbon are all beautifully arranged in a pink Satin Cylinder vase. A lovely way to celebrate! Vase may vary.",13 3/4" h x 14" w,https://cdn.floristone.com/small/T36-1A_t1.jpg,https://cdn.floristone.com/large/T36-1A_d1.jpg,https://cdn.floristone.com/hi-res/T36-1A_h1.jpg,http://www.floristone.com/detail.cfm?dcode=T36-1A&source_id=aff&affiliateid=2026051528,http://www.floristone.com/cart.cfm?dcode=T36-1A&source_id=aff&affiliateid=2026051528,1,1,1,1,1,1,1,0,One Sided Arrangements
Cotton Candy,T37-1A,84.9500,"What a sweet way to celebrate the arrival of sugar and spice and everything nice! This pretty arrangement will delight any new mom or mom-to-be, that's for sure! Feminine flowers fill a charming ribbon-wrapped vase. It's a beautiful thing! Pretty pink roses, spray roses and miniature carnations, white button spray chrysanthemums, lavender limonium and green pittosporum fill a spring glass vase that's wrapped with a pink satin ribbon. It's confection perfection!",13" h x 11" w,https://cdn.floristone.com/small/T37-1A_t1.jpg,https://cdn.floristone.com/large/T37-1A_d1.jpg,https://cdn.floristone.com/hi-res/T37-1A_h1.jpg,http://www.floristone.com/detail.cfm?dcode=T37-1A&source_id=aff&affiliateid=2026051528,http://www.floristone.com/cart.cfm?dcode=T37-1A&source_id=aff&affiliateid=2026051528,1,1,1,1,1,1,1,0,Vase Arrangements
