Name,Code,Price,Description,Dimensions,Thumbnail Image,Detail Image,Extra Large Image,Detail Page Link,Shopping Cart Link,Everyday,Birthday,Anniversary,Love and Romance,Get Well,New Baby,Thank You,Sympathy,Category
The New Dream Basket,D9-5212,79.9500,"With life's many twists and turns, there is always a new dream ready to take hold around the corner! In celebration of any of life's special moments, this lush and lovely fresh flower arrangement sends your warmest wishes in style. Orange roses, purple carnations, orange Peruvian Lilies, purple button poms, bupleurum, and lush greens are accented with a lavender gingham ribbon and presented in a rectangular woodchip basket to create a special surprise for your recipient. A wonderful way to say happy birthday, congratulations, or best wishes! ",13"w x 11"h,https://cdn.floristone.com/small/D9-5212_t1.jpg,https://cdn.floristone.com/large/D9-5212_d1.jpg,https://cdn.floristone.com/hi-res/D9-5212_h1.jpg,http://www.floristone.com/detail.cfm?dcode=D9-5212&source_id=aff&affiliateid=2026051528,http://www.floristone.com/cart.cfm?dcode=D9-5212&source_id=aff&affiliateid=2026051528,1,1,1,0,1,0,1,0,Centerpieces
The Red Rose Bouquet,E2-4305,89.9500,"Nothing speaks of love so much as a bouquet of beautiful red roses. Arranged with seeded eucalyptus in a classic glass vase, this bouquet is a gift to her heart from yours.",12"w x 18"h,https://cdn.floristone.com/small/E2-4305_t1.jpg,https://cdn.floristone.com/large/E2-4305_d1.jpg,https://cdn.floristone.com/hi-res/E2-4305_h1.jpg,http://www.floristone.com/detail.cfm?dcode=E2-4305&source_id=aff&affiliateid=2026051528,http://www.floristone.com/cart.cfm?dcode=E2-4305&source_id=aff&affiliateid=2026051528,1,1,1,1,0,0,0,0,Roses
The Lavender Rose Bouquet,E3-4811,89.9500,"An enchanting bouquet of lavender roses sweetly touches her heart. Paired with seeded eucalyptus in a stylish glass vase, these lovely roses are a perfect gift.",14"w x 18"h,https://cdn.floristone.com/small/E3-4811_t1.jpg,https://cdn.floristone.com/large/E3-4811_d1.jpg,https://cdn.floristone.com/hi-res/E3-4811_h1.jpg,http://www.floristone.com/detail.cfm?dcode=E3-4811&source_id=aff&affiliateid=2026051528,http://www.floristone.com/cart.cfm?dcode=E3-4811&source_id=aff&affiliateid=2026051528,1,1,1,1,0,0,0,0,Roses
The Pure Romance Rose Bouquet,E3-5238,79.9500,"Utterly romantic and blossoming with your love through every blushing bloom, this gorgeous rose bouquet is out to convey your heart's every wish. Hot pink, red, and lavender roses mingle with fragrant fuchsia gilly flowers, beautifully accented with lush greens while seated in a vibrant pink glass vase. The perfect anniversary, I love you, or Valentine's Day gift! ",11"w x 14"h,https://cdn.floristone.com/small/E3-5238_t1.jpg,https://cdn.floristone.com/large/E3-5238_d1.jpg,https://cdn.floristone.com/hi-res/E3-5238_h1.jpg,http://www.floristone.com/detail.cfm?dcode=E3-5238&source_id=aff&affiliateid=2026051528,http://www.floristone.com/cart.cfm?dcode=E3-5238&source_id=aff&affiliateid=2026051528,0,1,1,1,0,0,0,0,Vase Arrangements
The Bright Spark Rose Bouquet,E4-4809,89.9500,"This spirited bouquet holds roses in bold hues - hot pink, orange, red and bright yellow. Certain to be an attention-getter! These vivacious roses are arranged with seeded eucalyptus in a clear glass vase.",14"w x 19"h,https://cdn.floristone.com/small/E4-4809_t1.jpg,https://cdn.floristone.com/large/E4-4809_d1.jpg,https://cdn.floristone.com/hi-res/E4-4809_h1.jpg,http://www.floristone.com/detail.cfm?dcode=E4-4809&source_id=aff&affiliateid=2026051528,http://www.floristone.com/cart.cfm?dcode=E4-4809&source_id=aff&affiliateid=2026051528,1,1,1,1,1,0,0,0,Roses
The Blooming Masterpiece Rose Bouquet,E4-4819,89.9500,"The Blooming Masterpiece Rose Bouquet is a classic expression of love and sweet affection! A dozen red roses arrive accented with lush greens, all beautifully arranged in a clear glass vase. Approximately 17H x 14W. ",14"w x 17"h,https://cdn.floristone.com/small/E4-4819_t1.jpg,https://cdn.floristone.com/large/E4-4819_d1.jpg,https://cdn.floristone.com/hi-res/E4-4819_h1.jpg,http://www.floristone.com/detail.cfm?dcode=E4-4819&source_id=aff&affiliateid=2026051528,http://www.floristone.com/cart.cfm?dcode=E4-4819&source_id=aff&affiliateid=2026051528,1,1,1,1,1,0,0,0,Roses
The Enchanting Rose Bouquet,E4-4820,89.9500,"The Enchanting Rose Bouquet is a classic expression of love and sweet affection! A dozen mixed roses arrive accented with lush greens, all beautifully arranged in a clear glass vase. Approximately 17H x 13W. ",13"w x 17"h,https://cdn.floristone.com/small/E4-4820_t1.jpg,https://cdn.floristone.com/large/E4-4820_d1.jpg,https://cdn.floristone.com/hi-res/E4-4820_h1.jpg,http://www.floristone.com/detail.cfm?dcode=E4-4820&source_id=aff&affiliateid=2026051528,http://www.floristone.com/cart.cfm?dcode=E4-4820&source_id=aff&affiliateid=2026051528,1,1,1,1,1,0,1,0,Roses
The Simply Enchanting Rose Bouquet,E4-4822,79.9500,The Simply Enchanting Rose Bouquet brings together lush red roses to make a lasting impression. Gorgeous red roses are simply accented with a variety of fresh greens and perfectly situated in a classic clear glass vase to create a flower bouquet that conveys your hearts deepest desires for love and romance. Arrangement includes 6 stems. Approx. 15H x 12W. ,12"w x 15"h,https://cdn.floristone.com/small/E4-4822_t1.jpg,https://cdn.floristone.com/large/E4-4822_d1.jpg,https://cdn.floristone.com/hi-res/E4-4822_h1.jpg,http://www.floristone.com/detail.cfm?dcode=E4-4822&source_id=aff&affiliateid=2026051528,http://www.floristone.com/cart.cfm?dcode=E4-4822&source_id=aff&affiliateid=2026051528,1,1,1,1,0,0,0,0,Roses
The Pure Enchantment Rose Bouquet,E6-4821,99.9500,"The Pure Enchantment Rose Bouquet blossoms with brilliant roses in bright hues to capture your special recipient's every attention. Hot pink, lavender and orange roses create a splash of color accented with lush bupleurum to make an exceptional flower bouquet. Presented in a modern clear glass vase, this rose bouquet is set to send your warmest wishes for their birthday, as a thank you gift or to celebrate any of life's special moments. ",12"w x 18"h,https://cdn.floristone.com/small/E6-4821_t1.jpg,https://cdn.floristone.com/large/E6-4821_d1.jpg,https://cdn.floristone.com/hi-res/E6-4821_h1.jpg,http://www.floristone.com/detail.cfm?dcode=E6-4821&source_id=aff&affiliateid=2026051528,http://www.floristone.com/cart.cfm?dcode=E6-4821&source_id=aff&affiliateid=2026051528,1,1,1,1,0,0,0,0,Roses
The Yellow Rose Bouquet,E7-4808,89.9500,"Sunny yellow roses are a cheery and wonderful gift. Celebrate a birthday, anniversary, graduation or any occasion with this lively bouquet arranged with seeded eucalyptus in a clear glass vase.",15"w x 19"h,https://cdn.floristone.com/small/E7-4808_t1.jpg,https://cdn.floristone.com/large/E7-4808_d1.jpg,https://cdn.floristone.com/hi-res/E7-4808_h1.jpg,http://www.floristone.com/detail.cfm?dcode=E7-4808&source_id=aff&affiliateid=2026051528,http://www.floristone.com/cart.cfm?dcode=E7-4808&source_id=aff&affiliateid=2026051528,1,1,1,1,1,0,1,0,Roses
The Pink Rose Bouquet,E8-4304,89.9500,"Picture-perfect soft pink roses make a beautiful gift for the lovely lady in your life. Wife, mother, daughter or sweetheart, she's sure to cherish this bouquet of pastel pink roses accented with seeded eucalyptus and arranged in a clear glass vase. ",12"w x 18"h,https://cdn.floristone.com/small/E8-4304_t1.jpg,https://cdn.floristone.com/large/E8-4304_d1.jpg,https://cdn.floristone.com/hi-res/E8-4304_h1.jpg,http://www.floristone.com/detail.cfm?dcode=E8-4304&source_id=aff&affiliateid=2026051528,http://www.floristone.com/cart.cfm?dcode=E8-4304&source_id=aff&affiliateid=2026051528,1,1,1,1,0,1,0,0,Roses
The Graceful Grandeur Rose Bouquet ,E8-4810,89.9500,"The Graceful Grandeur Rose Bouquet offers your special recipient a bright assortment of roses to bring them joy with its exquisite beauty. Cream, orange, hot pink, coral and light pink roses are accented with lush greens and gorgeously arranged within a clear glass vase to create a lovely way to send your love, say thank you or even to extend your happy birthday wishes. ",14"w x 19"h,https://cdn.floristone.com/small/E8-4810_t1.jpg,https://cdn.floristone.com/large/E8-4810_d1.jpg,https://cdn.floristone.com/hi-res/E8-4810_h1.jpg,http://www.floristone.com/detail.cfm?dcode=E8-4810&source_id=aff&affiliateid=2026051528,http://www.floristone.com/cart.cfm?dcode=E8-4810&source_id=aff&affiliateid=2026051528,1,1,1,0,1,0,0,0,Roses
The White Rose Bouquet,E8-4812,89.9500,"The beauty of white roses is unchallenged. Representing innocence, their versatility makes them a favorite gift to offer congratulations for graduation, engagements, bridal showers, new baby, or even a gift of sympathy.",15"w x 19"h,https://cdn.floristone.com/small/E8-4812_t1.jpg,https://cdn.floristone.com/large/E8-4812_d1.jpg,https://cdn.floristone.com/hi-res/E8-4812_h1.jpg,http://www.floristone.com/detail.cfm?dcode=E8-4812&source_id=aff&affiliateid=2026051528,http://www.floristone.com/cart.cfm?dcode=E8-4812&source_id=aff&affiliateid=2026051528,1,1,1,0,0,1,0,0,Roses
The Soft Serenade Rose Bouquet,E8-4816,99.9500,"The Soft Serenade Rose Bouquet is a sunny and charming flower arrangement set to spread your warmest wishes. Pink roses, yellow spray roses, white hypericum berries, white limonium and lush greens are perfectly arranged within a clear glass bubble bowl vase to create a wonderful way to say thank you, get well or to extend your congratulations. ",12"w x 12"h,https://cdn.floristone.com/small/E8-4816_t1.jpg,https://cdn.floristone.com/large/E8-4816_d1.jpg,https://cdn.floristone.com/hi-res/E8-4816_h1.jpg,http://www.floristone.com/detail.cfm?dcode=E8-4816&source_id=aff&affiliateid=2026051528,http://www.floristone.com/cart.cfm?dcode=E8-4816&source_id=aff&affiliateid=2026051528,1,1,1,0,1,1,0,0,Roses
Sundance Rose Bouquet,E9-4817,104.9500,"The Rose Bouquet employs a soft assortment of roses to create a sweet and stunning arrangement. Cream, white, orange and pink roses are simply brought together in a clear glass bubble bowl vase to make an exquisite flower bouquet set to warm their heart when extending your warmest wishes for their birthday or just to say thinking of you.",12"w x 10"h,https://cdn.floristone.com/small/E9-4817_t1.jpg,https://cdn.floristone.com/large/E9-4817_d1.jpg,https://cdn.floristone.com/hi-res/E9-4817_h1.jpg,http://www.floristone.com/detail.cfm?dcode=E9-4817&source_id=aff&affiliateid=2026051528,http://www.floristone.com/cart.cfm?dcode=E9-4817&source_id=aff&affiliateid=2026051528,1,1,1,0,0,1,0,0,Roses
Fifteen peach roses,F1-110,99.9500,Fifteen long stemmed peach roses with ferns arranged in a glass vase.,25"h x 20"w,https://cdn.floristone.com/small/F1-110_t1.jpg,https://cdn.floristone.com/large/F1-110_d1.jpg,,http://www.floristone.com/detail.cfm?dcode=F1-110&source_id=aff&affiliateid=2026051528,http://www.floristone.com/cart.cfm?dcode=F1-110&source_id=aff&affiliateid=2026051528,1,1,1,1,0,0,0,0,Roses
Baby Boy Balloon Bouquet,F1-116,79.9500,Festive balloon bouquet consisting of 6 latex balloons and 2 mylar Baby Boy balloons. Balloon types may vary.,,https://cdn.floristone.com/small/fam116_t1.jpg,https://cdn.floristone.com/large/fam116_d1.jpg,,http://www.floristone.com/detail.cfm?dcode=F1-116&source_id=aff&affiliateid=2026051528,http://www.floristone.com/cart.cfm?dcode=F1-116&source_id=aff&affiliateid=2026051528,0,0,0,0,0,1,0,0,Balloons
Baby Girl Balloon Bouquet,F1-117,79.9500,Festive balloon bouquet consisting of 6 latex balloons and 2 mylar Baby Girl balloons. Balloon types may vary.,,https://cdn.floristone.com/small/fam117_t1.jpg,https://cdn.floristone.com/large/fam117_d1.jpg,,http://www.floristone.com/detail.cfm?dcode=F1-117&source_id=aff&affiliateid=2026051528,http://www.floristone.com/cart.cfm?dcode=F1-117&source_id=aff&affiliateid=2026051528,0,0,0,0,0,1,0,0,Balloons
Get Well Balloon Bouquet,F1-118,79.9500,Balloon bouquet consisting of 6 latex balloons and 2 mylar Get Well balloons. Balloon types may vary.,,https://cdn.floristone.com/small/fam118_t1.jpg,https://cdn.floristone.com/large/fam118_d1.jpg,,http://www.floristone.com/detail.cfm?dcode=F1-118&source_id=aff&affiliateid=2026051528,http://www.floristone.com/cart.cfm?dcode=F1-118&source_id=aff&affiliateid=2026051528,0,0,0,0,1,0,0,0,Balloons
Happy Anniversary Balloon Bouquet,F1-119,79.9500,Festive balloon bouquet consisting of 6 latex balloons and 2 mylar Happy Anniversary balloons. Balloon types may vary.,,https://cdn.floristone.com/small/fam119_t1.jpg,https://cdn.floristone.com/large/fam119_d1.jpg,,http://www.floristone.com/detail.cfm?dcode=F1-119&source_id=aff&affiliateid=2026051528,http://www.floristone.com/cart.cfm?dcode=F1-119&source_id=aff&affiliateid=2026051528,0,0,1,0,0,0,0,0,Balloons
Happy Birthday Balloon Bouquet,F1-120,79.9500,Festive balloon bouquet consisting of 6 latex balloons and 2 mylar Happy Birthday balloons. Balloon types may vary.,,https://cdn.floristone.com/small/fam120_t1.jpg,https://cdn.floristone.com/large/fam120_d1.jpg,,http://www.floristone.com/detail.cfm?dcode=F1-120&source_id=aff&affiliateid=2026051528,http://www.floristone.com/cart.cfm?dcode=F1-120&source_id=aff&affiliateid=2026051528,0,1,0,0,0,0,0,0,Balloons
I Love You Balloon Bouquet,F1-121,79.9500,Festive balloon bouquet consisting of 6 latex balloons and 2 mylar I Love You balloons. Balloon types may vary.,,https://cdn.floristone.com/small/fam121_t1.jpg,https://cdn.floristone.com/large/fam121_d1.jpg,,http://www.floristone.com/detail.cfm?dcode=F1-121&source_id=aff&affiliateid=2026051528,http://www.floristone.com/cart.cfm?dcode=F1-121&source_id=aff&affiliateid=2026051528,0,1,1,1,0,0,0,0,Balloons
Precious Pink Roses,F1-122,89.9500,Offer your eternal love and adoration with one dozen soft pink roses arranged with baby’s breath and lush greens in a clear glass vase., 20" W x 25" H,https://cdn.floristone.com/small/F1-122_t1.jpg,https://cdn.floristone.com/large/F1-122_d1.jpg,,http://www.floristone.com/detail.cfm?dcode=F1-122&source_id=aff&affiliateid=2026051528,http://www.floristone.com/cart.cfm?dcode=F1-122&source_id=aff&affiliateid=2026051528,1,1,1,1,1,1,0,1,Roses
Sympathy Spray,F1-2060,159.9500,"A standing spray of lilies, gladiolus, roses and more. Shown in shades of pink and white. Appropriate for funeral home.",42"h x 30"w,https://cdn.floristone.com/small/F1-2060_t1.jpg,https://cdn.floristone.com/large/F1-2060_d1.jpg,,http://www.floristone.com/detail.cfm?dcode=F1-2060&source_id=aff&affiliateid=2026051528,http://www.floristone.com/cart.cfm?dcode=F1-2060&source_id=aff&affiliateid=2026051528,0,0,0,0,0,0,0,1,Funeral - Sprays
Life Celebration Basket,F1-2111,94.9500,"Celebrate a life well lived and honor their passing with this serene basket arrangement of purple hydrangea, lavender and white roses and baby’s breath.",12" h x 16 " w,https://cdn.floristone.com/small/F1-2111_t1.jpg,https://cdn.floristone.com/large/F1-2111_d1.jpg,,http://www.floristone.com/detail.cfm?dcode=F1-2111&source_id=aff&affiliateid=2026051528,http://www.floristone.com/cart.cfm?dcode=F1-2111&source_id=aff&affiliateid=2026051528,0,1,0,0,0,0,0,1,Funeral - Baskets
Carnation vase,F1-214,79.9500,"Fragrant blossoms of standard and spray carnations in a classic glass vase. Shown in pinks and burgundy, but color may vary.",18"h x 15"w,https://cdn.floristone.com/small/F1-214_t1.jpg,https://cdn.floristone.com/large/F1-214_d1.jpg,,http://www.floristone.com/detail.cfm?dcode=F1-214&source_id=aff&affiliateid=2026051528,http://www.floristone.com/cart.cfm?dcode=F1-214&source_id=aff&affiliateid=2026051528,1,1,1,0,1,0,1,0,Vase Arrangements
Treasured Memories Basket,F1-218,129.9500,"A rich, colorful basket to honor treasured memories and a cherished life. Purple stock, yellow asiatic liles, lavender daisies and carnations and hot pink miniature carnations and purple statice are set in a wicker basket to send a message of peace, comfort and remembrance.",28" h x 21" w,https://cdn.floristone.com/small/F1-218_t1.jpg,https://cdn.floristone.com/large/F1-218_d1.jpg,,http://www.floristone.com/detail.cfm?dcode=F1-218&source_id=aff&affiliateid=2026051528,http://www.floristone.com/cart.cfm?dcode=F1-218&source_id=aff&affiliateid=2026051528,0,0,0,0,0,0,0,1,Funeral - Baskets
The Bold and Beautiful Arrangement,F1-2228,79.9500,"Show the strength of your love and affection with this harmonious arrangement of deep red roses and gerbera daises contrasting yellow solidago and delicate, decorative greens. Appropriate for any occasion including Birthday, Anniversary and Love and Romance.",18”h x 14”w,https://cdn.floristone.com/small/F1-2228_t1.jpg,https://cdn.floristone.com/large/F1-2228_d1.jpg,,http://www.floristone.com/detail.cfm?dcode=F1-2228&source_id=aff&affiliateid=2026051528,http://www.floristone.com/cart.cfm?dcode=F1-2228&source_id=aff&affiliateid=2026051528,1,1,0,0,0,0,0,0,One Sided Arrangements
Serene Lily Basket,F1-228,104.9500,"Peaceful white lillies are set against vibrant greens to create a truly serene basket. Grace and dignity flow from this arrangement of white lillies, carnations, minature carnations and lush greens. An elegant choice for a funeral service or the the family's home.",25" h x 26" w,https://cdn.floristone.com/small/F1-228_t1.jpg,https://cdn.floristone.com/large/F1-228_d1.jpg,,http://www.floristone.com/detail.cfm?dcode=F1-228&source_id=aff&affiliateid=2026051528,http://www.floristone.com/cart.cfm?dcode=F1-228&source_id=aff&affiliateid=2026051528,0,0,0,0,0,0,0,1,Funeral - Baskets
Best Wishes Basket And Balloons,F1-229,79.9500,"Send your best wishes, warmest sentiment, and an abundance of hope with colorful balloons and a lively round basket arrangement of white gerbera daisies, pink carnations, hot pink spray roses, lavender daisy pompons, purple statice and baby’s breath. Appropriate for any occasion including Birthday, Get Well and New Baby.",13"h x 13"w,https://cdn.floristone.com/small/F1-229_t1.jpg,https://cdn.floristone.com/large/F1-229_d1.jpg,,http://www.floristone.com/detail.cfm?dcode=F1-229&source_id=aff&affiliateid=2026051528,http://www.floristone.com/cart.cfm?dcode=F1-229&source_id=aff&affiliateid=2026051528,1,1,0,0,1,1,0,0,Balloons
The Precious Medley Bouquet,F1-231,79.9500,"Tenderness, beauty and elegance is offered with this assortment of pink alstromeria and carnations, fuchsia stock, matsumoto asters, yellow solidago and baby’s breath arranged in a clear glass vase. Appropriate for any occasion including Birthday, Anniversary, Get Well.",20"h x 16"w,https://cdn.floristone.com/small/F1-231_t1.jpg,https://cdn.floristone.com/large/F1-231_d1.jpg,,http://www.floristone.com/detail.cfm?dcode=F1-231&source_id=aff&affiliateid=2026051528,http://www.floristone.com/cart.cfm?dcode=F1-231&source_id=aff&affiliateid=2026051528,1,1,1,0,1,0,0,0,Vase Arrangements
Mixed summery flowers,F1-239,79.9500,"A festive mix of flowers with delphinium, peach gerbera, carnations, daisy spray mums, solidaster and tree fern.",15"h x 12"w,https://cdn.floristone.com/small/F1-239_t1.jpg,https://cdn.floristone.com/large/F1-239_d1.jpg,,http://www.floristone.com/detail.cfm?dcode=F1-239&source_id=aff&affiliateid=2026051528,http://www.floristone.com/cart.cfm?dcode=F1-239&source_id=aff&affiliateid=2026051528,0,1,1,0,0,0,0,0,Vase Arrangements
Eighteen carnations in a clear vase,F1-246,79.9500,"Eighteen carnations accented with greens in clear glass. Shown in yellow, but color may vary.",26"h x 22"w,https://cdn.floristone.com/small/F1-246_t1.jpg,https://cdn.floristone.com/large/F1-246_d1.jpg,,http://www.floristone.com/detail.cfm?dcode=F1-246&source_id=aff&affiliateid=2026051528,http://www.floristone.com/cart.cfm?dcode=F1-246&source_id=aff&affiliateid=2026051528,1,1,1,0,1,0,1,0,Vase Arrangements
A basket arrangement for a baby boy,F1-252,79.9500,"A basket of blue delphinium, blue iris and gerbera.",20"h x 12"w,https://cdn.floristone.com/small/F1-252_t1.jpg,https://cdn.floristone.com/large/F1-252_d1.jpg,,http://www.floristone.com/detail.cfm?dcode=F1-252&source_id=aff&affiliateid=2026051528,http://www.floristone.com/cart.cfm?dcode=F1-252&source_id=aff&affiliateid=2026051528,0,0,0,0,0,1,0,0,One Sided Arrangements
A basket of Mixed Garden Flowers,F1-305,119.9500,"A lavish basket of colorful flowers with asters, asiatic lilies, roses, sunflowers, larkspur and mini carnations.",32"h x 30"w,https://cdn.floristone.com/small/F1-305_t1.jpg,https://cdn.floristone.com/large/F1-305_d1.jpg,,http://www.floristone.com/detail.cfm?dcode=F1-305&source_id=aff&affiliateid=2026051528,http://www.floristone.com/cart.cfm?dcode=F1-305&source_id=aff&affiliateid=2026051528,0,0,0,0,0,0,0,1,Funeral - Table Arrangements
Colorful Heart,F1-306,314.9500,A solid flower heart of mixed flowers displayed on an easel. Appropriate for funeral home.Approximate Size: 21h x 21w,21"h x 21"w,https://cdn.floristone.com/small/F1-306_t1.jpg,https://cdn.floristone.com/large/F1-306_d1.jpg,,http://www.floristone.com/detail.cfm?dcode=F1-306&source_id=aff&affiliateid=2026051528,http://www.floristone.com/cart.cfm?dcode=F1-306&source_id=aff&affiliateid=2026051528,0,0,0,0,0,0,0,1,Funeral - Hearts
Wreath of Mixed White Flowers,F1-309,264.9500,"A solid all white wreath of lilies, gerberas, roses, carnations, roses and gypsophila. Appropriate for funeral home.",24"d,https://cdn.floristone.com/small/F1-309_t1.jpg,https://cdn.floristone.com/large/F1-309_d1.jpg,,http://www.floristone.com/detail.cfm?dcode=F1-309&source_id=aff&affiliateid=2026051528,http://www.floristone.com/cart.cfm?dcode=F1-309&source_id=aff&affiliateid=2026051528,0,0,0,0,0,0,0,1,Funeral - Wreaths
Basket Arrangement of Mixed White Flowers,F1-311,134.9500,"A garden basket in all white of lilies, roses, gerbera and snapdragons.",36"h x 18"w,https://cdn.floristone.com/small/F1-311_t1.jpg,https://cdn.floristone.com/large/F1-311_d1.jpg,,http://www.floristone.com/detail.cfm?dcode=F1-311&source_id=aff&affiliateid=2026051528,http://www.floristone.com/cart.cfm?dcode=F1-311&source_id=aff&affiliateid=2026051528,0,0,0,0,0,0,0,1,Funeral - Table Arrangements
The Forever Sweet Bouquet,F1-313,89.9500,"Beauty, tenderness and grace flow from the soft pink of this one-sided arrangement. Pink snapdragons, pink Asiatic lilies, pink Gerbera daisies, pink stock and bright pink carnations are arranged with vibrant greens in a white bowl container to offer your eternal affection and adoration.",28"h x 20"w,https://cdn.floristone.com/small/F1-313_t1.jpg,https://cdn.floristone.com/large/F1-313_d1.jpg,,http://www.floristone.com/detail.cfm?dcode=F1-313&source_id=aff&affiliateid=2026051528,http://www.floristone.com/cart.cfm?dcode=F1-313&source_id=aff&affiliateid=2026051528,0,0,0,0,0,0,0,1,Funeral - Table Arrangements
Mixed Spray,F1-315,149.9500,"A tribute spray of pink carnations, yellow spray mums, lilies, and gypsophila. Appropriate for funeral home.",36"h x 24"w,https://cdn.floristone.com/small/F1-315_t1.jpg,https://cdn.floristone.com/large/F1-315_d1.jpg,,http://www.floristone.com/detail.cfm?dcode=F1-315&source_id=aff&affiliateid=2026051528,http://www.floristone.com/cart.cfm?dcode=F1-315&source_id=aff&affiliateid=2026051528,0,0,0,0,0,0,0,1,Funeral - Sprays
Mixed flowers in a handled basket,F1-318,89.9500,"An abundant mix of alstroemeria, carnations, stock and daisy spray mums made as a floor basket appropriate for funeral home. Made in a plastic hoop basket or paper mache",28"h x 22"w,https://cdn.floristone.com/small/F1-318_t1.jpg,https://cdn.floristone.com/large/F1-318_d1.jpg,,http://www.floristone.com/detail.cfm?dcode=F1-318&source_id=aff&affiliateid=2026051528,http://www.floristone.com/cart.cfm?dcode=F1-318&source_id=aff&affiliateid=2026051528,0,0,0,0,0,0,0,1,Funeral - Baskets
Chrysanthemum Arrangement,F1-319,94.9500,A vase of white standard chrysanthemums and foliage.,27"h x 22"w,https://cdn.floristone.com/small/F1-319_t1.jpg,https://cdn.floristone.com/large/F1-319_d1.jpg,,http://www.floristone.com/detail.cfm?dcode=F1-319&source_id=aff&affiliateid=2026051528,http://www.floristone.com/cart.cfm?dcode=F1-319&source_id=aff&affiliateid=2026051528,0,0,0,0,0,0,0,1,Funeral - Table Arrangements
Pink and Lavender Harmony,F1-322,94.9500,"All pink basket of snapdragons, carnations, stargazer lilies and babies breath",33"h x 32"w,https://cdn.floristone.com/small/F1-322_t1.jpg,https://cdn.floristone.com/large/F1-322_d1.jpg,,http://www.floristone.com/detail.cfm?dcode=F1-322&source_id=aff&affiliateid=2026051528,http://www.floristone.com/cart.cfm?dcode=F1-322&source_id=aff&affiliateid=2026051528,0,0,0,0,0,0,0,1,Funeral - Baskets
Pink and Lavender Basket,F1-330,134.9500,"A sympathy basket filled with pink flowers including roses, lilies, gladiolas, gerbera and carnations.",38"h x 34"w,https://cdn.floristone.com/small/F1-330_t1.jpg,https://cdn.floristone.com/large/F1-330_d1.jpg,,http://www.floristone.com/detail.cfm?dcode=F1-330&source_id=aff&affiliateid=2026051528,http://www.floristone.com/cart.cfm?dcode=F1-330&source_id=aff&affiliateid=2026051528,0,0,0,0,0,0,0,1,Funeral - Baskets
Loving Sentiment Bouquet,F1-332,84.9500,"A flower medley that could be lovingly picked by hand on a garden walk. Offer peace and comfort with this harmonious arrangement of purple larkspur, soft pink roses, Stargazer lilies, lavender spider mums, pink alstroemeria, pink carnations, Bells of Ireland and purple statice arranged in a one-sided lavender vase. Suitable for a funeral service or the family's home.",30"h x 20"w,https://cdn.floristone.com/small/F1-332_t1.jpg,https://cdn.floristone.com/large/F1-332_d1.jpg,,http://www.floristone.com/detail.cfm?dcode=F1-332&source_id=aff&affiliateid=2026051528,http://www.floristone.com/cart.cfm?dcode=F1-332&source_id=aff&affiliateid=2026051528,0,0,0,0,0,0,0,1,Funeral - Table Arrangements
