Name,Code,Price,Description,Dimensions,Thumbnail Image,Detail Image,Extra Large Image,Detail Page Link,Shopping Cart Link,Everyday,Birthday,Anniversary,Love and Romance,Get Well,New Baby,Thank You,Sympathy,Category
Best Day Bouquet,B07,84.9500,"The Best Day Bouquet is ready to create a moment your recipient will always remember! An instant mood booster with it's mix of bright bold colors, this gorgeous fresh flower arrangement brings together sunflowers, hot pink roses, purple double lisianthus, orange LA Hybrid Lilies, yellow snapdragons, green button poms, and lush greens to make this day, their best day. Presented in a clear glass vase, this fresh flower arrangement is made just for you to help you send your warmest birthday, congratulations, or get well wishes to your favorite friends and family.",15"h x 12"w,https://cdn.floristone.com/small/B07_t1.jpg,https://cdn.floristone.com/large/B07_d1.jpg,https://cdn.floristone.com/hi-res/B07_h1.jpg,http://www.floristone.com/detail.cfm?dcode=B07&source_id=aff&affiliateid=2026051528,http://www.floristone.com/cart.cfm?dcode=B07&source_id=aff&affiliateid=2026051528,1,1,0,0,1,0,0,0,Vase Arrangements
Pink Posh Bouquet,B08,79.9500,"The Pink Posh Bouquet is chic and pink to help you celebrate life's most treasured moments in style! Hot pink roses are bright and beautiful arranged amongst pink Asiatic Lilies, pink stock, green button poms, bupleurum and lush greens to create that perfect gift of flowers. Presented in a clear glass vase, this blushing fresh flower arrangement is ready to send your sweetest wishes in honor of a birthday, an anniversary, or as a way to express your thanks and gratitude.",16"h x 13"w,https://cdn.floristone.com/small/B08_t1.jpg,https://cdn.floristone.com/large/B08_d1.jpg,https://cdn.floristone.com/hi-res/B08_h1.jpg,http://www.floristone.com/detail.cfm?dcode=B08&source_id=aff&affiliateid=2026051528,http://www.floristone.com/cart.cfm?dcode=B08&source_id=aff&affiliateid=2026051528,1,1,1,0,0,0,1,0,Vase Arrangements
Celebration of the Season Centerpiece,B10-4368,99.9500,The Celebration of the Season Centerpiece is a grand display of holiday elegance. Red roses and spray roses pop against a backdrop of assorted holiday greens and variegated holly that beautifully encircle three red taper candles. Accented with gold pinecones and gold metallic brocade ribbon this centerpiece creates a warm and enchanting glow to benefit their holiday festivities.,7"H x 14"W,https://cdn.floristone.com/small/B10-4368_t1.jpg,https://cdn.floristone.com/large/B10-4368_d1.jpg,https://cdn.floristone.com/hi-res/B10-4368_h1.jpg,http://www.floristone.com/detail.cfm?dcode=B10-4368&source_id=aff&affiliateid=2026051528,http://www.floristone.com/cart.cfm?dcode=B10-4368&source_id=aff&affiliateid=2026051528,0,0,0,0,0,0,0,0,Centerpieces
The Christmas Peace Bouquet,B10-4962,99.9500,"The Christmas Peace Bouquet brings beauty and grace to their home or holiday table with each elegant bloom. Rich red roses are a standout arranged amongst red carnations and mini carnations, red hypericum berries and an assortment of lush holiday greens. Accented with white pinecone pics and a red, white, and green plaid designer ribbon, this fresh flower bouquet is presented in a clear glass bubble bowl vase to create a wonderful Christmas gift for any of the special people in your life.",11"H x 12"W,https://cdn.floristone.com/small/B10-4962_t1.jpg,https://cdn.floristone.com/large/B10-4962_d1.jpg,https://cdn.floristone.com/hi-res/B10-4962_h1.jpg,http://www.floristone.com/detail.cfm?dcode=B10-4962&source_id=aff&affiliateid=2026051528,http://www.floristone.com/cart.cfm?dcode=B10-4962&source_id=aff&affiliateid=2026051528,0,0,0,0,0,0,0,0,Centerpieces
The Christmas Coziness  Basket,B10-5139,84.9500,"Adding warmth and a homespun look to your Christmas décor, this fresh and fragrant floral arrangement is a wonderful way to bring color and life to any corner of the home. An assortment of Christmas greens and variegated holly are arranged to perfection in a rectangular stained woodchip basket, accented with clusters of red berries, natural pinecones, and a festive red plaid ribbon. A wonderful holiday gift for your relatives, neighbors, or friends throughout the yuletide season ahead ",10"H x 15"W,https://cdn.floristone.com/small/B10-5139_t1.jpg,https://cdn.floristone.com/large/B10-5139_d1.jpg,https://cdn.floristone.com/hi-res/B10-5139_h1.jpg,http://www.floristone.com/detail.cfm?dcode=B10-5139&source_id=aff&affiliateid=2026051528,http://www.floristone.com/cart.cfm?dcode=B10-5139&source_id=aff&affiliateid=2026051528,0,0,0,0,0,0,0,0,Centerpieces
High Style Bouquet,B11,89.9500,"The High Style Bouquet is on-trend and ready to wow your special recipient with it's mix of bold and beautiful blooms! Rich red roses, Stargazer Lilies, pink Peruvian Lilies, burgundy mini carnations, pink statice, and lush greens are arranged to perfection by our floral professionals to create a gift of flowers that is set to impress. Presented in a clear glass vase, this fresh flower bouquet is a wonderful way to express your happy anniversary, happy birthday, or thinking of you wishes.",16"h x 13"w,https://cdn.floristone.com/small/B11_t1.jpg,https://cdn.floristone.com/large/B11_d1.jpg,https://cdn.floristone.com/hi-res/B11_h1.jpg,http://www.floristone.com/detail.cfm?dcode=B11&source_id=aff&affiliateid=2026051528,http://www.floristone.com/cart.cfm?dcode=B11&source_id=aff&affiliateid=2026051528,1,1,1,0,0,0,0,0,Vase Arrangements
The Spirit of the Season Bouquet,B11-5132,94.9500,"A sensational splash of red to celebrate the Christmas season in style, this impressive flower bouquet is ready to get you noticed. Red roses, gerbera daisies, Peruvian Lilies, mini carnations, and hypericum berries are accented with an assortment of fresh Christmas greens to create a joyful holiday look. Presented in a ruby red glass vase, this holiday flower arrangement is a heartfelt way for you to send your warmest season's greetings.",14"H x 12"W,https://cdn.floristone.com/small/B11-5132_t1.jpg,https://cdn.floristone.com/large/B11-5132_d1.jpg,https://cdn.floristone.com/hi-res/B11-5132_h1.jpg,http://www.floristone.com/detail.cfm?dcode=B11-5132&source_id=aff&affiliateid=2026051528,http://www.floristone.com/cart.cfm?dcode=B11-5132&source_id=aff&affiliateid=2026051528,0,0,0,0,0,0,0,0,Vase Arrangements
The Winter Wishes Basket,B12-5135,84.9500,"Taking traditional Christmas colors and turning up the volume to create a bright and brilliant arrangement, this fresh flower bouquet is ready to bring holiday joy to even the darkest corner of your recipient's home. Rich red roses and red carnations are accented with green hypericum berries, green button poms, clusters of shining red glass holiday balls, and an assortment of fragrant Christmas greens. Arranged to perfection in a white wash woodchip basket, this gift of flowers is ready to make a splash as a centerpiece, or when placed on the buffet table or side counter for their holiday gathering.",9"H x 12"W,https://cdn.floristone.com/small/B12-5135_t1.jpg,https://cdn.floristone.com/large/B12-5135_d1.jpg,https://cdn.floristone.com/hi-res/B12-5135_h1.jpg,http://www.floristone.com/detail.cfm?dcode=B12-5135&source_id=aff&affiliateid=2026051528,http://www.floristone.com/cart.cfm?dcode=B12-5135&source_id=aff&affiliateid=2026051528,0,0,0,0,0,0,0,0,Centerpieces
Red Poinsettia Basket (Small),B13-3601,84.9500,"The traditional holiday blooming plant, a Christmas Poinsettia, with its dark leaves and deep red flowers is the perfect gift for family and friends.",6" pot,https://cdn.floristone.com/small/B11-3601_t1.jpg,https://cdn.floristone.com/large/B11-3601_d1.jpg,https://cdn.floristone.com/hi-res/B13-3601_h1.jpg,http://www.floristone.com/detail.cfm?dcode=B13-3601&source_id=aff&affiliateid=2026051528,http://www.floristone.com/cart.cfm?dcode=B13-3601&source_id=aff&affiliateid=2026051528,0,0,0,0,0,0,0,0,Plants
Red Poinsettia Basket (Large),B13-3602,109.9500,"The traditional holiday blooming plant, a Christmas Poinsettia, with its dark leaves and deep red flowers is the perfect gift for family and friends.",8" pot,https://cdn.floristone.com/small/B11-3602_t1.jpg,https://cdn.floristone.com/large/B11-3602_d1.jpg,https://cdn.floristone.com/hi-res/B13-3602_h1.jpg,http://www.floristone.com/detail.cfm?dcode=B13-3602&source_id=aff&affiliateid=2026051528,http://www.floristone.com/cart.cfm?dcode=B13-3602&source_id=aff&affiliateid=2026051528,0,0,0,0,0,0,0,0,Plants
The Candy Cane Lane Bouquet,B13-5130,89.9500,"Stacking the odds of holiday fun in your recipient's favor, this fresh flower bouquet is a Christmas favorite that never goes out of style. Frilly red carnations are paired with red Peruvian Lilies surrounded by green button poms, variegated holly, and an assortment of fragrant Christmas greens. Accented with a bright green satin ribbon and classic candy canes, this festive holiday bouquet is that perfect way to say, Merry Christmas, to the ones you love throughout the yuletide season",13"H x 10"W,https://cdn.floristone.com/small/B13-5130_t1.jpg,https://cdn.floristone.com/large/B13-5130_d1.jpg,https://cdn.floristone.com/hi-res/B13-5130_h1.jpg,http://www.floristone.com/detail.cfm?dcode=B13-5130&source_id=aff&affiliateid=2026051528,http://www.floristone.com/cart.cfm?dcode=B13-5130&source_id=aff&affiliateid=2026051528,0,0,0,0,0,0,0,0,Vase Arrangements
The Holiday Bliss Bouquet,B13-5133,94.9500,"A winter wonderland that blossoms with an elegant holiday style, this fresh flower bouquet is set to delight your special recipient with each beautiful bloom. Crisp white Asiatic Lilies and chrysanthemums look snowy and bright amongst jade green roses, bright green button poms, gold pine cones, and an assortment of fragrant Christmas greens arranged beautifully in an eye-catching green swirled glass vase. A wonderful way to send your warmest season's greetings to your recipient this Christmas!",14"H x 11"W,https://cdn.floristone.com/small/B13-5133_t1.jpg,https://cdn.floristone.com/large/B13-5133_d1.jpg,https://cdn.floristone.com/hi-res/B13-5133_h1.jpg,http://www.floristone.com/detail.cfm?dcode=B13-5133&source_id=aff&affiliateid=2026051528,http://www.floristone.com/cart.cfm?dcode=B13-5133&source_id=aff&affiliateid=2026051528,0,0,0,0,0,0,0,0,Vase Arrangements
Free Spirit Bouquet,B14,79.9500,"The Free Spirit Bouquet celebrates life's most treasured moments in alluring blues and purples to create a fantastic gift of flowers. Inviting blue iris blooms add depth and texture to this fresh flower arrangement when set against lavender daisies, lavender statice, green button poms, and lush greens. Presented in a clear glass vase, this beautiful flower bouquet creates an impressive congratulations, thinking of you, or thank you gift. ",17"h x 12"w,https://cdn.floristone.com/small/B14_t1.jpg,https://cdn.floristone.com/large/B14_d1.jpg,https://cdn.floristone.com/hi-res/B14_h1.jpg,http://www.floristone.com/detail.cfm?dcode=B14&source_id=aff&affiliateid=2026051528,http://www.floristone.com/cart.cfm?dcode=B14&source_id=aff&affiliateid=2026051528,1,0,0,0,0,0,1,0,Vase Arrangements
The Season's Glow Centerpiece,B16-4830,99.9500,"The Season's Glow Centerpiece blooms with winter elegance and holiday enchantment to grace your Christmas celebrations. White LA hybrid lilies, carnations, chrysanthemums and statice are arranged amongst holiday greens and accented with gold pinecones and a gold plaid French wired ribbon for an exquisite look. Arranged to encircle 3 white taper candles, this stunning arrangement will bring a sweet sophistication to your holiday festivities",6"H x 19"W,https://cdn.floristone.com/small/B16-4830_t1.jpg,https://cdn.floristone.com/large/B16-4830_d1.jpg,https://cdn.floristone.com/hi-res/B16-4830_h1.jpg,http://www.floristone.com/detail.cfm?dcode=B16-4830&source_id=aff&affiliateid=2026051528,http://www.floristone.com/cart.cfm?dcode=B16-4830&source_id=aff&affiliateid=2026051528,0,0,0,0,0,0,0,0,Centerpieces
WhitePoinsettia Basket (Large),B17-3603,109.9500,The elegant winter white poinsettia is a lovely variation to a classic holiday gift.,8" pot,https://cdn.floristone.com/small/B17-3603_t1.jpg,https://cdn.floristone.com/large/B17-3603_d1.jpg,https://cdn.floristone.com/hi-res/B17-3603_h1.jpg,http://www.floristone.com/detail.cfm?dcode=B17-3603&source_id=aff&affiliateid=2026051528,http://www.floristone.com/cart.cfm?dcode=B17-3603&source_id=aff&affiliateid=2026051528,0,0,0,0,0,0,0,0,Plants
WhitePoinsettia Basket (Small),B17-3604,84.9500,The elegant winter white poinsettia is a lovely variation to a classic holiday gift.,6" pot,https://cdn.floristone.com/small/B17-3604_t1.jpg,https://cdn.floristone.com/large/B17-3604_d1.jpg,https://cdn.floristone.com/hi-res/B17-3604_h1.jpg,http://www.floristone.com/detail.cfm?dcode=B17-3604&source_id=aff&affiliateid=2026051528,http://www.floristone.com/cart.cfm?dcode=B17-3604&source_id=aff&affiliateid=2026051528,0,0,0,0,0,0,0,0,Plants
The Holiday Enchantment Bouquet,B17-5131,89.9500,"Beautiful, bright, and blooming with a broad holiday appeal, this gorgeous Christmas flower bouquet is simply enchanting at every turn. Gorgeous and full white snowball chrysanthemums are not to be upstaged when arranged amongst rich red roses, red carnations, and red mini carnations, accented with red hypericum berries and assorted Christmas greens to create a standout yuletide display. Presented in an attractive clear glass vase, this gift of flower is ready to create a treasured holiday moment for your recipient.",13"H x 11"W,https://cdn.floristone.com/small/B17-5131_t1.jpg,https://cdn.floristone.com/large/B17-5131_d1.jpg,https://cdn.floristone.com/hi-res/B17-5131_h1.jpg,http://www.floristone.com/detail.cfm?dcode=B17-5131&source_id=aff&affiliateid=2026051528,http://www.floristone.com/cart.cfm?dcode=B17-5131&source_id=aff&affiliateid=2026051528,0,0,0,0,0,0,0,0,Vase Arrangements
The Goodwill & Cheer Basket,B17-5134,89.9500,"A bright and cheerful Christmas arrangement, this unique basket of blooms can be used throughout the home as a centerpiece, to decorate the buffet, or to simply add a touch of holiday cheer to their favorite room, throughout the holiday season. Rich red roses, red mini carnations, white chrysanthemums, red hypericum berries, and fresh Christmas greens are accented with natural pinecones and a stylish red, green, and white striped grosgrain ribbon while situated in a round white wash woven handled basket. A wonderful way to send your season's greetings this December! ",9"H x 13"W,https://cdn.floristone.com/small/B17-5134_t1.jpg,https://cdn.floristone.com/large/B17-5134_d1.jpg,https://cdn.floristone.com/hi-res/B17-5134_h1.jpg,http://www.floristone.com/detail.cfm?dcode=B17-5134&source_id=aff&affiliateid=2026051528,http://www.floristone.com/cart.cfm?dcode=B17-5134&source_id=aff&affiliateid=2026051528,0,0,0,0,0,0,0,0,Centerpieces
The Glowing Elegance Centerpiece,B18-4964,109.9500,"The Glowing Elegance Centerpiece brings a warm sophistication to your holiday table with each snow-kissed bloom. White roses, spray roses, carnations, mini carnations and baby's breath are beautifully arranged amongst an assortment of lush holiday greens to create an incredible winter holiday display. With a glass hurricane at the center of this fresh flower arrangement holding a single white taper candle, this centerpiece is beautifully accented with a sheer green sparkle ribbon to create a stunning holiday gift for your favorite special recipient, or home accent for your own Christmas gathering.",6"H x 18"W,https://cdn.floristone.com/small/B18-4964_t1.jpg,https://cdn.floristone.com/large/B18-4964_d1.jpg,https://cdn.floristone.com/hi-res/B18-4964_h1.jpg,http://www.floristone.com/detail.cfm?dcode=B18-4964&source_id=aff&affiliateid=2026051528,http://www.floristone.com/cart.cfm?dcode=B18-4964&source_id=aff&affiliateid=2026051528,0,0,0,0,0,0,0,0,Centerpieces
The True Romance Rose Bouquet,B19-4387,89.9500,"The True Romance Rose Bouquet is the perfect expression of love and passion. A bright burst of color, this bouquet combines red, pink and fuchsia roses, accented with beautiful greens and seated in a clear glass vase, to create a truly romantic representation of your love. ",15"w x 22"h,https://cdn.floristone.com/small/B19-4387_t1.jpg,https://cdn.floristone.com/large/B19-4387_d1.jpg,https://cdn.floristone.com/hi-res/B19-4387_h1.jpg,http://www.floristone.com/detail.cfm?dcode=B19-4387&source_id=aff&affiliateid=2026051528,http://www.floristone.com/cart.cfm?dcode=B19-4387&source_id=aff&affiliateid=2026051528,1,1,1,1,0,0,0,0,Roses
Peace & Light Hanukkah Bouquet,B19-5143,94.9500,"A soft, charming, and stylish flower bouquet, this arrangement exudes warmth and light in celebration of Hanukkah helping you celebrate with those recipient's close to your heart. Clouds of blue hydrangea standout amongst the clean white of roses, carnations, and Peruvian Lilies accented with lush greens while seated in a modern blue glass cubed vase. A memorable way to spread peace, light, and love throughout the this festive holiday season! ",8"h x 8"w,https://cdn.floristone.com/small/B19-5143_t1.jpg,https://cdn.floristone.com/large/B19-5143_d1.jpg,https://cdn.floristone.com/hi-res/B19-5143_h1.jpg,http://www.floristone.com/detail.cfm?dcode=B19-5143&source_id=aff&affiliateid=2026051528,http://www.floristone.com/cart.cfm?dcode=B19-5143&source_id=aff&affiliateid=2026051528,0,0,0,0,0,0,0,0,Centerpieces
The Harvest Heartstrings Bouquet,B2-4957,79.9500,"The Harvest Heartstrings Bouquet brings sunlit autumn beauty straight to their door. Unforgettable mini sunflowers catch the eye at every turn surrounded by yellow Asiatic lilies, red dianthus, orange spray roses and lush greens to create a stunning fresh flower arrangement. Presented in a clear glass gathered square vase and accented throughout with red glycerized oak leaves, this flower bouquet is set to make an excellent birthday, thank you, get well or Thanksgiving gift.",12"w x 15"h,https://cdn.floristone.com/small/B2-4957_t1.jpg,https://cdn.floristone.com/large/B2-4957_d1.jpg,https://cdn.floristone.com/hi-res/B2-4957_h1.jpg,http://www.floristone.com/detail.cfm?dcode=B2-4957&source_id=aff&affiliateid=2026051528,http://www.floristone.com/cart.cfm?dcode=B2-4957&source_id=aff&affiliateid=2026051528,1,1,1,0,1,0,1,0,Vase Arrangements
The Vibrant Views Bouquet,B2-5123,79.9500,"Blooming with a vibrant light that can't be denied, this brilliant fall flower bouquet is ready to lift any mood and raise any spirit throughout the autumn months ahead. Swirling orange roses, orange spray roses, and star-shaped peach Asiatic Lilies are surrounded with the eye-catching textures of yellow solidago, bittersweet stems, aralia leaves and lush greens with brilliant yellow gourd accents tucked in a just the right spot, all beautifully arranged in an orange ceramic cylinder vase. A wonderful fall birthday, get well, thank you, or happy harvest gift!",11"w x 11"h,https://cdn.floristone.com/small/B2-5123_t1.jpg,https://cdn.floristone.com/large/B2-5123_d1.jpg,https://cdn.floristone.com/hi-res/B2-5123_h1.jpg,http://www.floristone.com/detail.cfm?dcode=B2-5123&source_id=aff&affiliateid=2026051528,http://www.floristone.com/cart.cfm?dcode=B2-5123&source_id=aff&affiliateid=2026051528,0,1,1,0,1,0,0,0,Vase Arrangements
The Tranquil Bouquet,B20-4970,79.9500,"This bouquet blooms with a sweet sophistication and style to bring a calming grace to any event or occasion. Hot pink and pink roses are brought together with purple, lavender and fuchsia stock stems accented with pink Peruvian lilies and lush greens to create a simply stunning flower arrangement. Presented in a clear glass bubble bowl vase, this exquisite fresh flower bouquet will make an excellent birthday, anniversary or sympathy gift.",12"H x 12"W,https://cdn.floristone.com/small/B20-4970_t1.jpg,https://cdn.floristone.com/large/B20-4970_d1.jpg,https://cdn.floristone.com/hi-res/B20-4970_h1.jpg,http://www.floristone.com/detail.cfm?dcode=B20-4970&source_id=aff&affiliateid=2026051528,http://www.floristone.com/cart.cfm?dcode=B20-4970&source_id=aff&affiliateid=2026051528,0,1,1,1,1,0,1,0,Centerpieces
The Bright Lights Bouquet,B21-4968,79.9500,"The Bright Lights Bouquet brings color and beauty straight to your special recipient's door! Yellow Asiatic lilies, pink roses, purple stock, lavender monte casino asters, pink carnations, pink mini carnations and lush greens are brought together to create a sweetly fascinating flower arrangement. Presented in a square lavender pastel washed basket, this fresh flower bouquet is set to make an excellent birthday, thank you or get well gift. ",14"w x 13"h,https://cdn.floristone.com/small/B21-4968_t1.jpg,https://cdn.floristone.com/large/B21-4968_d1.jpg,https://cdn.floristone.com/hi-res/B21-4968_h1.jpg,http://www.floristone.com/detail.cfm?dcode=B21-4968&source_id=aff&affiliateid=2026051528,http://www.floristone.com/cart.cfm?dcode=B21-4968&source_id=aff&affiliateid=2026051528,0,1,1,1,1,0,1,0,Centerpieces
Pure Perfection Bouquet,B21-4969,84.9500,"The Pure Perfection Bouquet exudes a bright beauty and bold sophistication to send your sweetest wishes to friends and family near and far. Hot pink roses, carnations, mini carnations and gerbera daisies are accented with brilliant blue iris and lush greens to create a fascinating flower arrangement. Presented in a clear glass cylinder vase lined with a ti leaf green material to give it an elegant and finished look, this gorgeous bouquet is set to make that perfect impression in honor of a birthday, anniversary, or as a way to express your congratulations or thank you sentiments.",12"h x 12"w,https://cdn.floristone.com/small/B21-4969_t1.jpg,https://cdn.floristone.com/large/B21-4969_d1.jpg,https://cdn.floristone.com/hi-res/B21-4969_h1.jpg,http://www.floristone.com/detail.cfm?dcode=B21-4969&source_id=aff&affiliateid=2026051528,http://www.floristone.com/cart.cfm?dcode=B21-4969&source_id=aff&affiliateid=2026051528,1,1,1,0,0,0,1,0,Centerpieces
The Blushing Invitations Bouquet,B21-5145,79.9500,"Exuding a special charm, with a casual fresh-from-the-garden look, this gorgeous spring bouquet is the perfect way to delight your recipient in honor of any of life's most treasured moments. Peach gerbera daisies are soft and sophisticated surrounded by pink roses, pink snapdragons, pink mini carnations, purple liatris, and lush greens arranged with an artist's eye in a gathered square clear glass vase. A wonderful way to celebrate a spring birthday, Mother's Day, or to express your thanks and gratitude.",7"w x 16"h,https://cdn.floristone.com/small/B21-5145_t1.jpg,https://cdn.floristone.com/large/B21-5145_d1.jpg,https://cdn.floristone.com/hi-res/B21-5145_h1.jpg,http://www.floristone.com/detail.cfm?dcode=B21-5145&source_id=aff&affiliateid=2026051528,http://www.floristone.com/cart.cfm?dcode=B21-5145&source_id=aff&affiliateid=2026051528,0,1,1,1,1,0,1,0,Vase Arrangements
The Spring Sunshine Bouquet,B21-5205,79.9500,"Ready to wake your recipient up to the arrival of the spring season with a bright array of sun crushed blooms, this vibrant flower bouquet exudes fun and beauty to their day. A bold rush of yellow, this flower arrangement brings together roses, daisies, gerbera daisies, and solidago accented with red and yellow tulips, lush greens, and tropical leaves. Arranged beautifully in a clear glass cubed vase to give it a modern trend forward look they will adore, this spring flower bouquet is ready to celebrate a birthday, Mother's Day, or Easter in blooming style. ",9"w x 8"h,https://cdn.floristone.com/small/B21-5205_t1.jpg,https://cdn.floristone.com/large/B21-5205_d1.jpg,https://cdn.floristone.com/hi-res/B21-5205_h1.jpg,http://www.floristone.com/detail.cfm?dcode=B21-5205&source_id=aff&affiliateid=2026051528,http://www.floristone.com/cart.cfm?dcode=B21-5205&source_id=aff&affiliateid=2026051528,0,1,1,0,1,1,1,0,Centerpieces
The Sweet Beginnings Bouquet,B22-5150,79.9500,"Bringing a blush to their cheeks with each soft, sweet bloom, this stunning spring flower bouquet is ready to surprise and delight your recipient. Clouds of white hydrangea blooms are the base of this arrangement, making the colors of the hot pink roses, pink gerbera daisies, and pink Peruvian Lilies pop against their clean, textured background. Accented with seeded eucalyptus and presented in a hot pink cylinder ceramic vase, this gorgeous flower bouquet is the perfect way to celebrate a birthday, the birth of a new baby girl, or a special anniversary.",12"w x 12"h,https://cdn.floristone.com/small/B22-5150_t1.jpg,https://cdn.floristone.com/large/B22-5150_d1.jpg,https://cdn.floristone.com/hi-res/B22-5150_h1.jpg,http://www.floristone.com/detail.cfm?dcode=B22-5150&source_id=aff&affiliateid=2026051528,http://www.floristone.com/cart.cfm?dcode=B22-5150&source_id=aff&affiliateid=2026051528,0,1,1,1,1,1,1,0,Centerpieces
The Always True Bouquet,B23-4966,79.9500,"The Always True Bouquet is blooming with sunlit color and gorgeous grace to create a stunning gift for any of life's special moments. Brilliant orange roses, spray roses and tulips are simply stunning arranged amongst hot pink mini carnations, purple tulips, dark pink Asiatic lilies and lush greens. Presented in a designer rectangular clear glass vase, this fresh flower arrangement will make that perfect impression when sent in honor of a birthday, anniversary or as a way to express your thanks and gratitude. ",13"w x 13"h,https://cdn.floristone.com/small/B23-4966_t1.jpg,https://cdn.floristone.com/large/B23-4966_d1.jpg,https://cdn.floristone.com/hi-res/B23-4966_h1.jpg,http://www.floristone.com/detail.cfm?dcode=B23-4966&source_id=aff&affiliateid=2026051528,http://www.floristone.com/cart.cfm?dcode=B23-4966&source_id=aff&affiliateid=2026051528,0,1,1,0,1,0,1,0,Vase Arrangements
