Name,Code,Price,Description,Dimensions,Thumbnail Image,Detail Image,Extra Large Image,Detail Page Link,Shopping Cart Link,Everyday,Birthday,Anniversary,Love and Romance,Get Well,New Baby,Thank You,Sympathy,Category
Always Graceful Basket,S5337s,94.9500,"Our Always Graceful Basket is a heartfelt offering of your condolences. Crafted with roses, lisianthus and stock, this touching tribute of flowers is a sweet display of soft serenity.",13"h x 15"w,https://cdn.floristone.com/small/S5337s_t1.jpg,https://cdn.floristone.com/large/S5337s_d1.jpg,https://cdn.floristone.com/hi-res/S5337s_h1.jpg,http://www.floristone.com/detail.cfm?dcode=S5337s&source_id=aff&affiliateid=2026051528,http://www.floristone.com/cart.cfm?dcode=S5337s&source_id=aff&affiliateid=2026051528,0,0,0,0,0,0,0,1,Funeral - Table Arrangements
Rustic Remembrance Basket,S5343s,94.9500,"Our Rustic Remembrance Basket is designed to share an expression of hope, grace and comfort within each yellow bloom. This bright and uplifting arrangement is crafted with hydrangea, roses and Queen Anne’s Lace. While it is perfectly sweet in size, it is best suited for a small table or within a residence.",13"h x 14"w,https://cdn.floristone.com/small/S5343s_t1.jpg,https://cdn.floristone.com/large/S5343s_d1.jpg,https://cdn.floristone.com/hi-res/S5343s_h1.jpg,http://www.floristone.com/detail.cfm?dcode=S5343s&source_id=aff&affiliateid=2026051528,http://www.floristone.com/cart.cfm?dcode=S5343s&source_id=aff&affiliateid=2026051528,0,0,0,0,0,0,0,1,Funeral - Table Arrangements
Beloved Blessings Arrangement,S5344s,159.9500,"The loss of someone we care about is incredibly difficult, but celebrating their life can often help. Our Beloved Blessings arrangement shares solace, comfort and radiance with those commemorating a loved one. It is handcrafted with hydrangea, Cremon mums and carnations to create a thoughtful tribute.",24"h x 20"w,https://cdn.floristone.com/small/S5344s_t1.jpg,https://cdn.floristone.com/large/S5344s_d1.jpg,https://cdn.floristone.com/hi-res/S5344s_h1.jpg,http://www.floristone.com/detail.cfm?dcode=S5344s&source_id=aff&affiliateid=2026051528,http://www.floristone.com/cart.cfm?dcode=S5344s&source_id=aff&affiliateid=2026051528,0,0,0,0,0,0,0,1,Funeral - Table Arrangements
Calming Comfort Bouquet,S5345s,94.9500,"Accented by a deep blue vase, our Calming Comfort Bouquet is crafted with iris, lilies, stock and delphinium. This unique mix of blue and white flowers makes a well-suited tribute to send to those memorializing the loss of a male or someone who had a soothing presence. While this arrangement is perfectly sweet in size, it is best suited for a small table or in a home.",17"h x 15"w,https://cdn.floristone.com/small/S5345s_t1.jpg,https://cdn.floristone.com/large/S5345s_d1.jpg,https://cdn.floristone.com/hi-res/S5345s_h1.jpg,http://www.floristone.com/detail.cfm?dcode=S5345s&source_id=aff&affiliateid=2026051528,http://www.floristone.com/cart.cfm?dcode=S5345s&source_id=aff&affiliateid=2026051528,0,0,0,0,0,0,0,1,Funeral - Table Arrangements
Harmony & Grace Basket,S5346s,104.9500,"Crafted with a modern mix of blooms, our Harmony & Grace Basket shares peace, harmony and solace to a grieving loved one. While the bouquet is crafted with an elegant collection of roses, delphinium and carnations, it is your sentiment that truly brings this arrangement together. While this arrangement is effortlessly beautiful, it is best suited to be placed on a table or stand.",14"h x 20"w,https://cdn.floristone.com/small/S5346s_t1.jpg,https://cdn.floristone.com/large/S5346s_d1.jpg,https://cdn.floristone.com/hi-res/S5346s_h1.jpg,http://www.floristone.com/detail.cfm?dcode=S5346s&source_id=aff&affiliateid=2026051528,http://www.floristone.com/cart.cfm?dcode=S5346s&source_id=aff&affiliateid=2026051528,0,0,0,0,0,0,0,1,Funeral - Table Arrangements
Circle of Love Wreath,S5348s,349.9500,"Deliver your sympathy in a thoughtful and supportive way with our beautiful Circle of Love Wreath. This bold, colorful collection of blooms celebrates and commemorates the life of a lost loved one.",23" diameter,https://cdn.floristone.com/small/S5348s_t1.jpg,https://cdn.floristone.com/large/S5348s_d1.jpg,https://cdn.floristone.com/hi-res/S5348s_h1.jpg,http://www.floristone.com/detail.cfm?dcode=S5348s&source_id=aff&affiliateid=2026051528,http://www.floristone.com/cart.cfm?dcode=S5348s&source_id=aff&affiliateid=2026051528,0,0,0,0,0,0,0,1,Funeral - Wreaths
Pride & Unity Arrangement,S5349s,314.9500,"With blooms that capture every bold color of the rainbow, our Pride & Unity Arrangement celebrates and commemorates the life of a lost loved one. This beautiful collection of flowers embodies all shades in its collections of roses, stock, gerbera daisies, hydrangea and more. It’s wide variety of flowers complement one another and your messages of support.",32"h x 30"w,https://cdn.floristone.com/small/S5349s_t1.jpg,https://cdn.floristone.com/large/S5349s_d1.jpg,https://cdn.floristone.com/hi-res/S5349s_h1.jpg,http://www.floristone.com/detail.cfm?dcode=S5349s&source_id=aff&affiliateid=2026051528,http://www.floristone.com/cart.cfm?dcode=S5349s&source_id=aff&affiliateid=2026051528,0,0,0,0,0,0,0,1,Funeral - Table Arrangements
Prideful Basket,S5350s,129.9500,Our Prideful Basket shares support and comfort during times of sensitivity. This arrangement is designed with a mix of truly unique flowers in each bold shade of the rainbow to remind loved ones of how much you truly care about them and the one you are remembering.,14"h x 22"w,https://cdn.floristone.com/small/S5350s_t1.jpg,https://cdn.floristone.com/large/S5350s_d1.jpg,https://cdn.floristone.com/hi-res/S5350s_h1.jpg,http://www.floristone.com/detail.cfm?dcode=S5350s&source_id=aff&affiliateid=2026051528,http://www.floristone.com/cart.cfm?dcode=S5350s&source_id=aff&affiliateid=2026051528,0,0,0,0,0,0,0,1,Funeral - Table Arrangements
Exquisite Tribute Standing Spray,S6-4447,194.9500,"The Exquisite Tribute Standing Spray is an elegant display of sweet serenity. White roses, Asiatic lilies, chrysanthemums and mini carnations are artfully arranged amongst emerald palm fronds and lush greens. Accented by white satin ribbon and standing on a wire easel, this standing spray is an outstanding way to honor the life of your loved one.",32"h x 20"w,https://cdn.floristone.com/small/S6-4447_t1.jpg,https://cdn.floristone.com/large/S6-4447_d1.jpg,https://cdn.floristone.com/hi-res/S6-4447_h1.jpg,http://www.floristone.com/detail.cfm?dcode=S6-4447&source_id=aff&affiliateid=2026051528,http://www.floristone.com/cart.cfm?dcode=S6-4447&source_id=aff&affiliateid=2026051528,0,0,0,0,0,0,0,1,Funeral - Sprays
Peace & Serenity Dishgarden,S9-4454,79.9500,The Peace & Serenity Dishgarden is a gorgeous way to convey your deepest sympathies for your special recipient's loss. A collection of incredibly beautiful plants accented by fresh cut stems of white Peruvian lilies. Variety of plants and basket style will vary.,18"h x 13"w,https://cdn.floristone.com/small/S9-4454_t1.jpg,https://cdn.floristone.com/large/S9-4454_d1.jpg,https://cdn.floristone.com/hi-res/S9-4454_h1.jpg,http://www.floristone.com/detail.cfm?dcode=S9-4454&source_id=aff&affiliateid=2026051528,http://www.floristone.com/cart.cfm?dcode=S9-4454&source_id=aff&affiliateid=2026051528,0,0,0,0,0,0,0,1,Plants
Stratford Gardens,T09J400A,79.9500,"For a gift that’s reminiscent of a stroll through the English countryside, send this stunning mix of pink and peach roses mingled with cool lavender chrysanthemums, arranged in a misty lavender vase. It’s as charming as a cottage garden. Pink spray roses, waxflower and hot pink miniature carnations, plus peach roses and lavender cushion spray chrysanthemums – accented with bupleurum, seeded eucalyptus and oregonia – are delivered in a lavender sweetheart vase. Style and color of vase may vary.",13" h x 11" w,https://cdn.floristone.com/small/T09J400A_t1.jpg,https://cdn.floristone.com/large/T09J400A_d1.jpg,https://cdn.floristone.com/hi-res/T09J400A_h1.jpg,http://www.floristone.com/detail.cfm?dcode=T09J400A&source_id=aff&affiliateid=2026051528,http://www.floristone.com/cart.cfm?dcode=T09J400A&source_id=aff&affiliateid=2026051528,1,1,1,1,1,0,0,0,Vase Arrangements
Roman Holiday,T10-1A,139.9500,"Want to know the true meaning of a Roman Holiday? If you ask us, it's really a romance holiday where true love blossoms! In this case, it's presented gorgeously. Beautiful dark pink hydrangea, red and lavender roses, carnations in dark purple and lavender, hot pink freesia and lavender phlox are perfectly arranged in a simply lovely cylinder vase.",14" h x 12" w,https://cdn.floristone.com/small/T10-1A_t1.jpg,https://cdn.floristone.com/large/T10-1A_d1.jpg,https://cdn.floristone.com/hi-res/T10-1A_h1.jpg,http://www.floristone.com/detail.cfm?dcode=T10-1A&source_id=aff&affiliateid=2026051528,http://www.floristone.com/cart.cfm?dcode=T10-1A&source_id=aff&affiliateid=2026051528,1,1,1,1,0,0,0,0,Centerpieces
Enchanted Journey,T10-2A,79.9500,"Romance that stands all the tests of time is like an enchanted journey. This beautiful arrangement is a wonderful way to celebrate that love. Gorgeous dark pink hydrangea, pink roses and carnations, plus lavender statice are lovingly arranged in an plum-colored cube vase.Vase may vary.",9" h x 9" w,https://cdn.floristone.com/small/T10-2A_t1.jpg,https://cdn.floristone.com/large/T10-2A_d1.jpg,https://cdn.floristone.com/hi-res/T10-2A_h1.jpg,http://www.floristone.com/detail.cfm?dcode=T10-2A&source_id=aff&affiliateid=2026051528,http://www.floristone.com/cart.cfm?dcode=T10-2A&source_id=aff&affiliateid=2026051528,1,1,1,1,1,0,1,0,Centerpieces
A Little Pink Me Up,T10-3A,79.9500,"Youthful. Graceful. Beautiful. These are just a few qualities that come to mind when gazing at a gorgeous bouquet of pink flowers. Whether you want this arrangement to say Happy Anniversary or Happy Any Day, you can be sure the day it arrives will be brighter for anyone lucky enough to receive it. Lovely pink roses and asiatic lilies are joined by hot pink gerberas and miniature carnations, pink full-sized carnations and more in a clear glass ball. Send this one and life will be a bowl of cheer!",14 1/2" h x 13 3/4" w,https://cdn.floristone.com/small/T10-3A_t1.jpg,https://cdn.floristone.com/large/T10-3A_d1.jpg,https://cdn.floristone.com/hi-res/T10-3A_h1.jpg,http://www.floristone.com/detail.cfm?dcode=T10-3A&source_id=aff&affiliateid=2026051528,http://www.floristone.com/cart.cfm?dcode=T10-3A&source_id=aff&affiliateid=2026051528,1,1,1,1,0,0,0,0,Centerpieces
Serene Retreat,T100-3A,94.9500,"A wondrous collection of assorted indoor green plants perfect for a home or office, it's a great gift for any occasion. Container and plants will vary.",15" h x 14 1/2" w,https://cdn.floristone.com/small/T100-3A_t1.jpg,https://cdn.floristone.com/large/T100-3A_d1.jpg,https://cdn.floristone.com/hi-res/T100-3A_h1.jpg,http://www.floristone.com/detail.cfm?dcode=T100-3A&source_id=aff&affiliateid=2026051528,http://www.floristone.com/cart.cfm?dcode=T100-3A&source_id=aff&affiliateid=2026051528,1,1,1,0,1,0,1,1,Plants
Amazing Arboricola,T104-3A,119.9500,"Also known as the umbrella plant due to its lovely arching leafy branches, this is an amazing gift. It can last for years and lend its graceful beauty to any home or office. Standing almost three feet tall in its olive green ceramic planter, this arboricola is a natural. Color and style of container may vary.",34 1/2" h x 27" w,https://cdn.floristone.com/small/T104-3A_t1.jpg,https://cdn.floristone.com/large/T104-3A_d1.jpg,https://cdn.floristone.com/hi-res/T104-3A_h1.jpg,http://www.floristone.com/detail.cfm?dcode=T104-3A&source_id=aff&affiliateid=2026051528,http://www.floristone.com/cart.cfm?dcode=T104-3A&source_id=aff&affiliateid=2026051528,1,0,0,0,0,0,0,1,Plants
Simply Elegant Spathiphyllum ,T105-1A,84.9500,"Also known as the peace lily, this dark leafy plant with its delicate white blossoms makes a simply elegant gift. There's nothing small about the sentiment delivered along with this pretty plant. A brilliant green spathiphyllum is delivered in a natural wicker basket. Long live elegance!",29 1/2" h x 22" w,https://cdn.floristone.com/small/T105-1A_t1.jpg,https://cdn.floristone.com/large/T105-1A_d1.jpg,https://cdn.floristone.com/hi-res/T105-1A_h1.jpg,http://www.floristone.com/detail.cfm?dcode=T105-1A&source_id=aff&affiliateid=2026051528,http://www.floristone.com/cart.cfm?dcode=T105-1A&source_id=aff&affiliateid=2026051528,1,0,0,0,0,0,1,1,Plants
Emerald Garden Basket,T106-1A,84.9500,You don't have to follow the yellow brick road to find this emerald jewel. All kinds of gorgeous greens fill this basket that makes a perfect gift for men or women. Celebration or sympathy. Birthday or any day. So beautiful and bountiful it will deliver any message eloquently. Variety of plants and container style will vary.,17 1/4" h x 17 1/2" w,https://cdn.floristone.com/small/T106-1A_t1.jpg,https://cdn.floristone.com/large/T106-1A_d1.jpg,https://cdn.floristone.com/hi-res/T106-1A_h1.jpg,http://www.floristone.com/detail.cfm?dcode=T106-1A&source_id=aff&affiliateid=2026051528,http://www.floristone.com/cart.cfm?dcode=T106-1A&source_id=aff&affiliateid=2026051528,1,1,1,1,1,0,1,1,Plants
Stately Croton,T106-2A,79.9500,"The croton is dignified and delightful. Its glossy green leaves carry vibrant accents of red and orange, making it the perfect plant for a wide variety of locations. Easy to care for and easy to love, this is one plant that is sure to brighten everyone's day. An impressively graceful croton is delivered in an elegant burgundy footed planter. A grand gesture indeed! Container may vary",33 1/2" h x 32 1/2" w,https://cdn.floristone.com/small/T106-2A_t1.jpg,https://cdn.floristone.com/large/T106-2A_d1.jpg,https://cdn.floristone.com/hi-res/T106-2A_h1.jpg,http://www.floristone.com/detail.cfm?dcode=T106-2A&source_id=aff&affiliateid=2026051528,http://www.floristone.com/cart.cfm?dcode=T106-2A&source_id=aff&affiliateid=2026051528,1,0,0,0,0,0,1,1,Plants
Wondrous Wishes,T11-1A,94.9500,"Awe and wonder. That's what's included in this magical bouquet. It's a beautiful mix of radiant blossoms in a stunning glass vase. Brilliant blue hydrangea, orange roses, light pink asiatic lilies, hot pink gerberas, pink alstroemeria, purple chrysanthemums and more fill a fabulously feminine vase. Send wonder with your lovely wishes! Vase may vary.",17" h x 14 1/2" w,https://cdn.floristone.com/small/T11-1A_t1.jpg,https://cdn.floristone.com/large/T11-1A_d1.jpg,https://cdn.floristone.com/hi-res/T11-1A_h1.jpg,http://www.floristone.com/detail.cfm?dcode=T11-1A&source_id=aff&affiliateid=2026051528,http://www.floristone.com/cart.cfm?dcode=T11-1A&source_id=aff&affiliateid=2026051528,1,1,1,1,1,0,1,0,Vase Arrangements
Be My Love,T128-2A,84.9500,"Add some romance with this rich arrangement of luxurious flowers in classic Valentine's colors. Red roses, white lilies and playful daisies are gathered in a ruby red vase!",17" h x 11" w,https://cdn.floristone.com/small/T128-2A_t1.jpg,https://cdn.floristone.com/large/T128-2A_d1.jpg,https://cdn.floristone.com/hi-res/T128-2A_h1.jpg,http://www.floristone.com/detail.cfm?dcode=T128-2A&source_id=aff&affiliateid=2026051528,http://www.floristone.com/cart.cfm?dcode=T128-2A&source_id=aff&affiliateid=2026051528,1,1,1,1,0,0,0,0,Vase Arrangements
Silver Elegance Centerpiece,T132-1A,79.9500,"This silvery centerpiece is so elegant it practically speaks for itself. Perfect for a Christmas, New Year's or any other winter gala, its shimmery sophistication will light up the room. Beautiful winter white hydrangea, asiatic lilies, carnations and greens surround three exquisite silver taper candles. It's as graceful as it is grand.",18 1/2" h x 21" w,https://cdn.floristone.com/small/T132-1A_t1.jpg,https://cdn.floristone.com/large/T132-1A_d1.jpg,https://cdn.floristone.com/hi-res/T132-1A_h1.jpg,http://www.floristone.com/detail.cfm?dcode=T132-1A&source_id=aff&affiliateid=2026051528,http://www.floristone.com/cart.cfm?dcode=T132-1A&source_id=aff&affiliateid=2026051528,0,0,0,0,0,0,0,0,Centerpieces
Elegant Evening,T132-2A,79.9500,"When the occasion requires elegance, you need look no further than this fabulous bouquet that's all dressed up in winter whites and silver. Stunning white roses, carnations and chrysanthemums are exquisitely arranged with silver painted salal stems in a silvery, satiny cylinder vase. The evening and the arrangement will be ones to remember!",13" h x 12" w,https://cdn.floristone.com/small/T132-2A_t1.jpg,https://cdn.floristone.com/large/T132-2A_d1.jpg,https://cdn.floristone.com/hi-res/T132-2A_h1.jpg,http://www.floristone.com/detail.cfm?dcode=T132-2A&source_id=aff&affiliateid=2026051528,http://www.floristone.com/cart.cfm?dcode=T132-2A&source_id=aff&affiliateid=2026051528,0,0,0,0,0,0,0,0,One Sided Arrangements
Joyful Jubilee,T14-1A,79.9500,"Sending a jubilation of flowers is a joyful way to brighten any celebration. This particular arrangement is eye-catching, colorful and captivating. Hot pink spray roses and gerberas, dark pink Sweet William, lavender matsumoto and purple monte cassino asters are joined by greens in an exclusive lavender keepsake vase. Tied with a ribbon, it's ready to shine. Vase may vary.",17" h x 14" w,https://cdn.floristone.com/small/T14-1A_t1.jpg,https://cdn.floristone.com/large/T14-1A_d1.jpg,https://cdn.floristone.com/hi-res/T14-1A_h1.jpg,http://www.floristone.com/detail.cfm?dcode=T14-1A&source_id=aff&affiliateid=2026051528,http://www.floristone.com/cart.cfm?dcode=T14-1A&source_id=aff&affiliateid=2026051528,1,1,1,1,1,0,1,0,Vase Arrangements
Lily Sunshine,T140-2A,79.9500,"When it comes to spring flowers, the lily reigns supreme. It's easy to see why in this gorgeous bouquet of bright yellow blooms. A fabulous bouquet of yellow asiatic lilies, salal and seeded eucalyptus are delivered in a divine bunch vase.",20 1/4" h x 16 1/4" w,https://cdn.floristone.com/small/T140-2A_t1.jpg,https://cdn.floristone.com/large/T140-2A_d1.jpg,https://cdn.floristone.com/hi-res/T140-2A_h1.jpg,http://www.floristone.com/detail.cfm?dcode=T140-2A&source_id=aff&affiliateid=2026051528,http://www.floristone.com/cart.cfm?dcode=T140-2A&source_id=aff&affiliateid=2026051528,1,1,0,0,1,1,1,0,Vase Arrangements
Peaches and Dreams,T145-3A,79.9500,"The only thing sweeter than peaches and cream just might be this dreamy bouquet of delicious roses and tulips. Be a peach and send one today! Pretty in peach roses, tulips, miniature carnations and stock along with white waxflower and fresh spring greens are beautifully arranged in a ceramic French country container.",13" h x 12 1/2" w,https://cdn.floristone.com/small/T145-3A_t1.jpg,https://cdn.floristone.com/large/T145-3A_d1.jpg,https://cdn.floristone.com/hi-res/T145-3A_h1.jpg,http://www.floristone.com/detail.cfm?dcode=T145-3A&source_id=aff&affiliateid=2026051528,http://www.floristone.com/cart.cfm?dcode=T145-3A&source_id=aff&affiliateid=2026051528,0,0,0,0,0,0,0,0,Centerpieces
One Fine Day,T147-2A,79.9500,"Oh, what a fine day it will be when you have this delightful spring bouquet delivered to someone special. Everyone will delight in the vibrant colors and bountiful blossoms, all thoughtfully arranged in a beautiful leaf-lined vase. Light yellow roses, hot pink spray roses, tulips and gerberas, yellow carnations, green button spray chrysanthemums and lavender cushion spray chrysanthemums are delivered in an exclusive cube vase. You'll have many fine days when you send this beautiful bouquet!",9 3/4" h X 9 1/4"w,https://cdn.floristone.com/small/T147-2A_t1.jpg,https://cdn.floristone.com/large/T147-2A_d1.jpg,https://cdn.floristone.com/hi-res/T147-2A_h1.jpg,http://www.floristone.com/detail.cfm?dcode=T147-2A&source_id=aff&affiliateid=2026051528,http://www.floristone.com/cart.cfm?dcode=T147-2A&source_id=aff&affiliateid=2026051528,1,1,1,0,0,0,1,0,Vase Arrangements
Fairest of All,T147-3A,79.9500,"You won't need a mirror, mirror on the wall to decide which bouquet is the fairest of all. No doubt this beauty will win that contest! Light orange roses, hot pink roses light pink alstroemeria, ranunculas and matsumoto asters, green button spray chrysanthemums and more are delightfully delivered in a charming ivy handled woven basket. Send one to your fair lady!",14" h x 18" w,https://cdn.floristone.com/small/T147-3A_t1.jpg,https://cdn.floristone.com/large/T147-3A_d1.jpg,https://cdn.floristone.com/hi-res/T147-3A_h1.jpg,http://www.floristone.com/detail.cfm?dcode=T147-3A&source_id=aff&affiliateid=2026051528,http://www.floristone.com/cart.cfm?dcode=T147-3A&source_id=aff&affiliateid=2026051528,1,1,1,1,1,0,1,0,Centerpieces
Here Comes The Sun,T152-1A,104.9500,"Here comes the sun and it's all bright, especially when it comes to this gorgeous bouquet. Anyone who receives this golden arrangement will definitely feel its warmth. As if green roses next to yellow sunflowers and snapdragons weren't brilliant enough, we've added white stock, green button spray chrysanthemums in a  vase.Vase may vary.",25" h x 18" h,https://cdn.floristone.com/small/T152-1A_t1.jpg,https://cdn.floristone.com/large/T152-1A_d1.jpg,https://cdn.floristone.com/hi-res/T152-1A_h1.jpg,http://www.floristone.com/detail.cfm?dcode=T152-1A&source_id=aff&affiliateid=2026051528,http://www.floristone.com/cart.cfm?dcode=T152-1A&source_id=aff&affiliateid=2026051528,1,1,1,1,1,0,1,1,Vase Arrangements
Sunny Sunflowers,T152-2A,79.9500,"Whoever receives this stunning bouquet is sure to be bowled over by its bold beauty! It's big on fun and big on flowers. Orange spray roses, yellow sunflowers, curly willow and salal are arranged in a charming ball vase. Order it now to send a ton of sun.",10" h x 12" w,https://cdn.floristone.com/small/T152-2A_t1.jpg,https://cdn.floristone.com/large/T152-2A_d1.jpg,https://cdn.floristone.com/hi-res/T152-2A_h1.jpg,http://www.floristone.com/detail.cfm?dcode=T152-2A&source_id=aff&affiliateid=2026051528,http://www.floristone.com/cart.cfm?dcode=T152-2A&source_id=aff&affiliateid=2026051528,1,1,1,0,1,0,1,0,Vase Arrangements
Glorious Day,T154-1A,109.9500,"Some people like their lemonade yellow, while others prefer pink. Guess what? This glorious arrangement caters to both! Pretty pink and lemon yellow blossoms are served up gloriously in a vase. Yellow and light pink roses, pink spray roses and fresh greenery are delivered in a stylish vase.",14 1/2" h x 13" w,https://cdn.floristone.com/small/T154-1A_t1.jpg,https://cdn.floristone.com/large/T154-1A_d1.jpg,https://cdn.floristone.com/hi-res/T154-1A_h1.jpg,http://www.floristone.com/detail.cfm?dcode=T154-1A&source_id=aff&affiliateid=2026051528,http://www.floristone.com/cart.cfm?dcode=T154-1A&source_id=aff&affiliateid=2026051528,1,1,1,1,0,0,0,0,Roses
Citrus Kissed,T157-1A,79.9500,"Like freshly squeezed lemonade on a hot sunny day, this bright and cheerful bouquet is a summer sensation. Dark orange, coral and orange roses, light yellow carnations, yellow button spray chrysanthemums and greens fill a slender gathering vase. It's a kiss of summer!",14" h x 11" w,https://cdn.floristone.com/small/T157-1A_t1.jpg,https://cdn.floristone.com/large/T157-1A_d1.jpg,https://cdn.floristone.com/hi-res/T157-1A_h1.jpg,http://www.floristone.com/detail.cfm?dcode=T157-1A&source_id=aff&affiliateid=2026051528,http://www.floristone.com/cart.cfm?dcode=T157-1A&source_id=aff&affiliateid=2026051528,1,1,1,0,1,0,1,0,Vase Arrangements
Sunny Siesta,T157-3A,79.9500,"Know someone who could use a little pick-me-up? Sending this pretty summer arrangement will definitely do the trick. Light orange roses and alstroemeria, yellow asiatic lilies and orange gerberas are delivered in an organza ribbon-wrapped cylinder vase. Siesta or fiesta – it's all good.",10" h x 11 1/2" w,https://cdn.floristone.com/small/T157-3A_t1.jpg,https://cdn.floristone.com/large/T157-3A_d1.jpg,https://cdn.floristone.com/hi-res/T157-3A_h1.jpg,http://www.floristone.com/detail.cfm?dcode=T157-3A&source_id=aff&affiliateid=2026051528,http://www.floristone.com/cart.cfm?dcode=T157-3A&source_id=aff&affiliateid=2026051528,1,1,1,1,0,0,0,0,Vase Arrangements
Summer Chic,T158-1A,79.9500,"Hot times require haute arrangements. Look no further because this vibrant vase full of vivacious flowers has va-voom written all over it. Light orange roses, orange asiatic lilies, hot pink dahlias and carnations are delivered in a dazzling cube vase. Chic? For sure!Color of vase may vary.",11" h x 10 1/2" w,https://cdn.floristone.com/small/T158-1A_t1.jpg,https://cdn.floristone.com/large/T158-1A_d1.jpg,https://cdn.floristone.com/hi-res/T158-1A_h1.jpg,http://www.floristone.com/detail.cfm?dcode=T158-1A&source_id=aff&affiliateid=2026051528,http://www.floristone.com/cart.cfm?dcode=T158-1A&source_id=aff&affiliateid=2026051528,1,1,1,0,1,0,1,0,Vase Arrangements
Sunsplash,T159-1A,79.9500,"Send this summery bouquet and you'll make a splendid splash! Perfect for birthdays, thank yous, barbecues and beyond. This warm-weather charmer will be welcome everywhere! Hot pink roses, orange spray roses, yellow asiatic lilies, hot pink matsumoto asters and green button spray chrysanthemums are delivered in a cube vase. Lots of splash. Not too much cash!",11" h x 11 1/2" w,https://cdn.floristone.com/small/T159-1A_t1.jpg,https://cdn.floristone.com/large/T159-1A_d1.jpg,https://cdn.floristone.com/hi-res/T159-1A_h1.jpg,http://www.floristone.com/detail.cfm?dcode=T159-1A&source_id=aff&affiliateid=2026051528,http://www.floristone.com/cart.cfm?dcode=T159-1A&source_id=aff&affiliateid=2026051528,1,1,1,0,1,0,1,0,Vase Arrangements
